title,address,description,price,date,seller,image5 bedroom house for sale,"Melbury Road, Holland Park, London, W14","A fully detached house measuring 4,927 square feet, with a large west-facing garden and off-street parking for 2 – 3 cars. This five bedroom family home is laid out over three floors only with no lower ground floor or basement. There is fantastic living space focused around a la...","£12,000,000",22/06/2020,"Russell Simpson, Kensington",https://media.rightmove.co.uk:443/dir/crop/10:9-16:9/205k/204992/93867653/204992_RUS180209_IMG_01_0000_max_476x317.jpg
5 bedroom semi-detached house for sale,"Warwick Avenue, London, W9","An exceptional period, semi-detached house for sale in W9. An exceptional period, semi-detached house refurbished and restored to the highest possible standards whilst retaining the home's great charm and character.
This beautiful, stucco-fronted detached, freehold house has undergone an extensi...","£12,000,000",07/08/2020,"Knight Frank, St John's Wood",https://media.rightmove.co.uk:443/dir/crop/10:9-16:9/66k/65830/79679119/65830_SJW190161_IMG_01_0001_max_476x317.jpg
5 bedroom terraced house for sale,"Chesterfield Street, London, W1J","A Grande 5 bedroom Mayfair townhouse with private terrace Chesterfield Street is a prime Mayfair location situated between Charles Street and Curzon Street with close proximity to Hyde Park, Green Park and Berkeley Square. Arranged over 5 floors, this stunning period townhouse incorporates a rar...","£11,950,000",03/02/2018,"Knight Frank, Mayfair",https://media.rightmove.co.uk:443/dir/crop/10:9-16:9/66k/65815/71254709/65815_WER170091_IMG_08_0001_max_476x317.jpg
5 bedroom detached house for sale,"Holland Park, Holland Park, London, W11","A wonderful maisonette set over two floors of this imposing Grade II listed villa boasting a wonderful, south facing garden and excellent entertaining space with a 48ft drawing room on the raised ground floor.","£11,950,000",21/02/2017,"Carter Jonas, Holland Park",https://media.rightmove.co.uk:443/dir/crop/10:9-16:9/49k/48570/78965408/48570_HOL140018_IMG_01_0000_max_476x317.jpg
5 bedroom semi-detached house for sale,"Chelsea Square, London, SW3","Beautiful family house located in renowned Chelsea Square. Chelsea Square, one of the largest and most beautifully maintained private garden squares in central London, was originally laid out by Cadogan Estate in 1812 as Trafalgar Square, but never completed. The south and east sides were enti...","£11,950,000",16/06/2020,"Knight Frank, Chelsea",https://media.rightmove.co.uk:443/dir/crop/10:9-16:9/66k/65803/71204532/65803_RVC170416_IMG_01_0000_max_476x317.jpg
5 bedroom house for sale,"Fairholt Street, Knightsbridge, London","Having been through a comprehensive refurbishment program, creating approximately 4,600 sq ft of internal accommodation, this unusually wide house has a frontage of over 28ft.","£11,950,000",22/11/2018,"Strutt & Parker, Knightsbridge",https://media.rightmove.co.uk:443/dir/crop/10:9-16:9/45k/44264/77332370/44264_SLN170097_IMG_02_0000_max_476x317.jpg
4 bedroom terraced house for sale,"Montrose Place, Belgravia, London, SW1X","A truly exceptional low built house, newly developed and architect designed to provide flexible, spacious and well balanced accommodation over four floors only, located in this quiet residential street in the heart of Belgravia. The attention to detail and bespoke features maximise light and volu...","£11,950,000",13/04/2018,"Best Gapp, Belgravia - Sales",https://media.rightmove.co.uk:443/dir/crop/10:9-16:9/45k/44442/66480033/44442_BGP180027_IMG_01_0000_max_476x317.jpg
5 bedroom terraced house for sale,"Chester Terrace, Regents Park, London, NW1","A classical Nash residence that has been re-designed and refurbished in recent years and has exceptional views across Regent's Park. The house offers 4494 Sq.ft of family accommodation, with the added benefit of a passenger lift which accesses all floors. From the grand entrance hall on the grou...","£11,950,000",26/09/2019,"Ian Green Residential, London",https://media.rightmove.co.uk:443/dir/crop/10:9-16:9/74k/73947/74383795/73947_29131013_IMG_01_0000_max_476x317.jpg
6 bedroom semi-detached house for sale,"Queens Grove, St Johns Wood, London, NW8","VIRTUAL TOUR AVAILABLE An exceptional opportunity to acquire a beautiful Grade II Listed semi-detached period residence and adjoining Studio House (471.3 sq m/5,073 sq ft) enviably located on one of the most sought after roads on the east side of St John's Wood just off Avenue Road. Th...","£11,950,000",22/06/2020,"Aston Chase, London",https://media.rightmove.co.uk:443/dir/crop/10:9-16:9/85k/84235/81234904/84235_RGS200073_IMG_12_0000_max_476x317.jpg
2 bedroom apartment for sale,"Clarges Mayfair, Mayfair, London, W1J",An impressive second floor lateral apartment overlooking Green Park in this landmark new development in Mayfair.,"£11,950,000",29/08/2018,"Savills, Mayfair",https://media.rightmove.co.uk:443/dir/crop/10:9-16:9/50k/49602/83478002/49602_MAS180072_IMG_01_0000_max_476x317.jpg
5 bedroom terraced house for sale,"Chelsea Square, London, SW3",A MAGNIFICENT FAMILY HOUSE LOCATED IN THIS PRIME CHELSEA SQUARE,"£11,950,000",01/02/2020,"Savills, Knightsbridge",https://media.rightmove.co.uk:443/dir/crop/10:9-16:9/26k/25602/92833730/25602_SLH170090_IMG_01_0000_max_476x317.jpg
4 bedroom apartment for sale,"Ennismore Gardens, Knightsbridge SW7","An immaculate four bedroom lateral apartment situated on the third floor, with lift access, of this grand south east corner building, directly overlooking the famous Ennismore Garden Square.","£11,900,000",19/06/2020,"Rokstone, London",https://media.rightmove.co.uk:443/dir/crop/10:9-16:9/177k/176396/93751364/176396_2403_IMG_01_0000_max_476x317.jpg
3 bedroom flat for sale,"Montrose Place, Belgravia, London","An exceptional three bedroom lateral apartment, benefitting from a 36 ft south facing reception room leading to a private terrace, 24 hour concierge service, underground parking for two cars and separate staff accommodation.","£11,795,000",01/08/2019,"Strutt & Parker, Knightsbridge",https://media.rightmove.co.uk:443/dir/crop/10:9-16:9/45k/44264/83697752/44264_SLN190006_IMG_05_0000_max_476x317.jpg
3 bedroom apartment for sale,"Jubilee Court West, New Capital Quay, 20 Victoria Parade, Greenwich, SE10",Excellent Greenwich Riverside Location | River Views | Close to Greenwich Market and Cutty Sark DLR | Superb 3 bed Value | Onsite Waitrose - Costa - Gym - Riverside Bars | 785 SqFt plus Balcony | EWS1 Grade B1 Pass | 5th Floor | 2 Bathrooms | Ready to View | 987 year Lease | Ground Rent £35...,"£600,000",06/08/2020,"MyLondonHome, Canary Wharf",https://media.rightmove.co.uk:443/dir/crop/10:9-16:9/107k/106976/95778104/106976_CAD200262_IMG_01_0000_max_476x317.jpg
5 bedroom detached house for sale,"Marlborough Place, London, NW8","This elegant detached low built family house spans over 6,086 sqft and is arranged over three floors only. Featuring spacious entertaining areas, indoor swimming pool with adjoining leisure area and secure off-street parking for up to four cars. The house sits on a generous plot with beautiful fr...","£11,750,000",29/03/2019,"'s International Realty, London",https://media.rightmove.co.uk:443/dir/crop/10:9-16:9/63k/62080/71566960/62080_LON190150_IMG_01_0000_max_476x317.jpg
4 bedroom flat for sale,"Grosvenor Square, London, W1K","A luxurious penthouse for sale in Grosvenor Square, Mayfair A luxurious four bedroom penthouse for sale, located on prestigious Grosvenor Square. Offering spacious accommodation throughout, the property further benefits from an excellent prime location in Mayfair EPC: E. This impressive penthou...","£11,750,000",02/12/2019,"Knight Frank, Mayfair",https://media.rightmove.co.uk:443/dir/crop/10:9-16:9/66k/65815/87108485/65815_WER190078_IMG_01_0001_max_476x317.jpg
4 bedroom flat for sale,"Vicarage Gate House, Vicarage Gate, Kensington, London, W8.","A fantastic 4 bedroom house for sale in W8 Vicarage Gate House is an exquisite new development of 13 exceptional apartments designed by leading London architect, Eric Parry. Perfectly positioned between elegant High Street Kensington, fashionable Notting Hill and adjacent to the mansions of ...","£11,500,000",04/06/2020,"Knight Frank, Kensington",https://media.rightmove.co.uk:443/dir/crop/10:9-16:9/66k/65809/80470387/65809_HPE190136_IMG_01_0000_max_476x317.jpg
4 bedroom detached house for sale,"Hamilton Drive, St Johns Wood, London, NW8","Exquisite white stucco-fronted house for sale in NW8. Hamilton Drive is an exceptional new development secretly located behind electric gates with an on-site concierge service. The grand white, stucco-fronted houses combine the best of modern living with the grandeur and charm of a period villa....","£11,500,000",18/03/2020,"Knight Frank, St John's Wood",https://media.rightmove.co.uk:443/dir/crop/10:9-16:9/66k/65830/78277297/65830_SJW012046797_IMG_01_0000_max_476x317.jpg
5 bedroom maisonette for sale,"South Audley Street, Mayfair, W1K",A rare opportunity to create one of Mayfair’s finest homes on highly sought-after South Audley Street with private access and lift in prime location to the area's finest amenities.,"£11,325,000",04/11/2016,"Carter Jonas, Mayfair",https://media.rightmove.co.uk:443/dir/crop/10:9-16:9/49k/48609/45267045/48609_MAY140009_IMG_31_0001_max_476x317.jpg
4 bedroom penthouse for sale,"St. Edmunds Terrace, St. John's Wood, London, NW8",A rare opportunity to purchase a four bedroom duplex penthouse apartment in this prestigious new development,"£11,300,000",23/01/2019,"Savills, St John's Wood & Regent's Park",https://media.rightmove.co.uk:443/dir/crop/10:9-16:9/79k/78202/63852780/78202_STS170178_IMG_01_0000_max_476x317.jpg
4 bedroom flat for sale,"St Edmund's Terrace, St John's Wood, London, NW8 ","A stunning four double bedroom Penthouse apartment located on the fourth and fifth floors of this recently built landmark building. The apartment is arranged over 3,817 sq.ft. / 354.6 sq.m. with South and East facing terraces on both floors facing towards Regent's Park and the London skyline. Int...","£11,300,000",16/10/2018,"Arlington Residential, London",https://media.rightmove.co.uk:443/dir/crop/10:9-16:9/196k/195398/59514087/195398_28467418_IMG_11_0000_max_476x317.jpg
5 bedroom semi-detached house for sale,"Warwick Avenue, Little Venice, London, W9","A unique white stucco period house backing directly onto one of the finest communal gardens in London. The property, which was the subject of a major refurbishment programme several years ago, is found in excellent condition and offers superb sized family accommodation along with a 3 person passe...","£11,250,000",08/02/2020,"Ian Green Residential, London",https://media.rightmove.co.uk:443/dir/crop/10:9-16:9/74k/73947/77326927/73947_29462917_IMG_01_0000_max_476x317.jpg
3 bedroom apartment for sale,"Francis Street, Westminster, London, SW1P","An exceptional apartment, comprising over 5,300 square feet of lateral space, set in a landmark industrial style building, and showcasing a stunning bespoke interior. The current owner has designed and created this striking apartment to perfectly complement the industrial nature of the...","£11,210,000",20/01/2020,"Russell Simpson, Chelsea",https://media.rightmove.co.uk:443/dir/crop/10:9-16:9/47k/46451/67616184/46451_RUS190077_IMG_04_0000_max_476x317.jpg
3 bedroom apartment for sale,"Francis Street, Westminster, London, SW1P","A stunning, sophisticated and unique apartment which has been meticulously designed, created and maintained by the current owner, with two car parking spaces. Situated on the first floor of this iconic landmark building, which was ambitiously developed by the renowned Italian designer Alessandro ...","£11,210,000",17/01/2020,"Barnes International Realty, London",https://media.rightmove.co.uk:443/dir/crop/10:9-16:9/177k/176336/92965457/176336_BAI190009_IMG_10_0000_max_476x317.jpg
5 bedroom semi-detached house for sale,"Mallord Street, London, SW3","Stunning and beautifully presented, 5 bedroom period house.","£11,200,000",25/07/2020,"Savills, Chelsea",https://media.rightmove.co.uk:443/dir/crop/10:9-16:9/79k/78262/72082866/78262_KEH090030_IMG_01_0000_max_476x317.jpg
3 bedroom terraced house for sale,"Eldon Road, London, W8","A unique freehold house with a historical past (circa 4,469 sq ft) benefiting from an outstanding first floor 'studio style' reception room and further flexible, spacious accommodation. The house is presented in immaculate structural condition and decorated with impeccable taste.","£11,000,000",11/07/2020,"Hamptons International Sales, Kensington",https://media.rightmove.co.uk:443/dir/crop/10:9-16:9/38k/37922/94693298/37922_KEN180132_IMG_02_0000_max_476x317.jpg
4 bedroom penthouse for sale,"Bolsover Street, Fitzrovia, London, W1W",Arguably the finest penthouse in Fitzrovia with the rarity of a roof terrace boasting fabulous views over central London and Regent’s Park. ,"£11,000,000",15/03/2020,"Savills, Marylebone",https://media.rightmove.co.uk:443/dir/crop/10:9-16:9/105k/104930/69095352/104930_MBS200006_IMG_05_0000_max_476x317.jpg
2 bedroom apartment for sale,"One Hyde Park, Knightsbridge","Luxury two double bedroom property in the coveted One Hyde Park, Knightsbridge.","£11,000,000",18/09/2019,"The Cloister, London",https://media.rightmove.co.uk:443/dir/crop/10:9-16:9/52k/51305/94223717/51305_5396_IMG_01_0000_max_476x317.jpg
3 bedroom apartment for sale,"Montrose Place, Belgravia, London, SW1X","An exceptional lateral ground floor apartment (circa 3,567 sq ft) situated in one of the most pre-eminent and prestigious recent developments in Knightsbridge and Belgravia, with the benefit of 24 hour security and concierge, and private underground parking for two cars. Montrose Place...","£11,000,000",08/11/2019,"Aylesford International, Chelsea",https://media.rightmove.co.uk:443/dir/crop/10:9-16:9/43k/42848/86428832/42848_CHE080135_IMG_01_0000_max_476x317.jpg
5 bedroom terraced house for sale,"Chester Terrace, London","A rare opportunity to purchase an outstanding Grade I Listed Nash house (427 sq m/4,596 sq ft) located in one of the finest terraces in the Crown Estate with fantastic views onto Regent's Park. The property has been recently refurbished and redesigned to the highest standard and provid...",POA,18/01/2020,"Sandfords, Regents Park",https://media.rightmove.co.uk:443/dir/crop/10:9-16:9/46k/45144/67713219/45144_RGP190002_IMG_01_0000_max_476x317.jpg
3 bedroom penthouse for sale,"Marylebone Square, Marylebone, W1","Marylebone Square Is A Brand New Luxury Development Of 54 High-End Homes, Including 12 Penthouses. One Of The Largest Penthouses In The Building, Spanning 2,336 Sq Ft (217 Sq Meters) with a 545 Sq Ft (50 Sq Meters) West Facing Terrace.","£10,963,000",12/02/2020,"Knightsbridge, Estate Agents",https://media.rightmove.co.uk:443/dir/crop/10:9-16:9/112k/111955/77447515/111955_751_IMG_01_0000_max_476x317.jpg
6 bedroom end of terrace house for sale,"Chapel Street, Belgravia, London, SW1X","Set just off Belgrave Square this beautiful 6 bedroom house offers bespoke and stylish interiors over 6 floors with gorgeous reception rooms, private Lift and en-suites to all bedrooms.","£10,950,000",03/10/2018,"Foxtons, Sloane Square",https://media.rightmove.co.uk:443/dir/crop/10:9-16:9/17k/16023/93971873/16023_1040852_IMG_01_0000_max_476x317.jpg
6 bedroom terraced house for sale,"Montpelier Square, Knightsbridge, London, SW7","6 bedroom house for sale with lift in Knightsbridge SW7 A superb Grade II listed family townhouse, with lift, quietly located on Montpelier Square in the heart of Knightsbridge benefiting from a patio garden, roof terrace and south facing views over the square gardens. Approximately 395 sq. m (4...","£10,950,000",25/10/2018,"Knight Frank, Knightsbridge",https://media.rightmove.co.uk:443/dir/crop/10:9-16:9/66k/65827/76675928/65827_SLA180134_IMG_01_0003_max_476x317.jpg
6 bedroom terraced house for sale,"Chapel Street, Belgravia, London, SW1X","An exception 6 bedroom Belgravia townhouse for sale with lift Covering approximately 361 sq m (3,887 sq ft) this freehold townhouse is located at the favoured Western end of Chapel Street, Belgravia with views over the gardens of Belgrave Square. The house has been recently refurbished and benef...","£10,950,000",16/08/2019,"Knight Frank, Belgravia, covering Westminster",https://media.rightmove.co.uk:443/dir/crop/10:9-16:9/95k/94745/73588090/94745_BGV190045_IMG_01_0002_max_476x317.jpg
6 bedroom terraced house for sale,"Montpelier Square, Knightsbridge, SW7","A substantial and impeccably designed six bedroom townhouse with lift, situated on the northern terrace of this prestigious garden square in the heart of Knightsbridge. ","£10,950,000",30/09/2019,"Chestertons Estate Agents , Knightsbridge",https://media.rightmove.co.uk:443/dir/crop/10:9-16:9/32k/31608/94916525/31608_CHE190063_IMG_05_0000_max_476x317.jpg
6 bedroom terraced house for sale,"Montpelier Square, SW7","Occupying one of the best positions, facing south and directly overlooking the square gardens, this elegant period townhouse (4247 sq ft/ 395 sqm) is arranged over six floors with a passenger lift to the 2nd floor. The property has been totally refurbished and interior designed to the highest spe...","£10,950,000",14/10/2019,"Harrods Estates, Knightsbridge",https://media.rightmove.co.uk:443/dir/crop/10:9-16:9/136k/135008/65741664/135008_KNI090267_IMG_01_0000_max_476x317.jpg
6 bedroom end of terrace house for sale,"Chapel Street, Belgravia, SW1X","An exceptional six bedroom end-of-terrace townhouse with lift, impeccably designed to the very highest standard and superbly located at the western end of Chapel Street offering wonderful views of Belgrave Square. ","£10,950,000",08/10/2019,"Chestertons Estate Agents , Knightsbridge",https://media.rightmove.co.uk:443/dir/crop/10:9-16:9/32k/31608/94922534/31608_HEA195150_IMG_05_0001_max_476x317.jpg
6 bedroom detached house for sale,"Hamilton Terrace, St John's Wood, London, NW8",A charming detached family home situated on the west side of this prestigious tree lined boulevard.,"£10,950,000",16/05/2019,"Savills, St John's Wood & Regent's Park",https://media.rightmove.co.uk:443/dir/crop/10:9-16:9/79k/78202/63852855/78202_STS180158_IMG_01_0000_max_476x317.jpg
2 bedroom flat for sale,"School Lane, Surbiton, KT6","Arranged over 2 floors, this well proportioned 2 bedroom flat benefits from its own private entrance, separate kitchen, external storage space and an excellent location.","£270,000",28/07/2020,"Foxtons, Kingston",https://media.rightmove.co.uk:443/dir/crop/10:9-16:9/58k/57272/70095249/57272_1120091_IMG_03_0000_max_476x317.jpg
6 bedroom end of terrace house for sale,"Chapel Street, SW1X","Situated at the Belgrave Square end of Chapel Street, this very handsome end of terrace, five/six bedroom period townhouse (3889 sqft/ 361.3 sqm) is arranged over six floors (lift to the 2nd floor) with open views towards Belgrave Square. The property has been totally refurbished to the highest s...","£10,950,000",01/10/2019,"Harrods Estates, Knightsbridge",https://media.rightmove.co.uk:443/dir/crop/10:9-16:9/136k/135008/85305344/135008_KNI090268_IMG_08_0000_max_476x317.jpg
6 bedroom house for sale,"Montpelier Square, Knightsbridge, London, SW7",With a south-facing aspect towards one of the most prestigious squares in Knightsbridge this stunning 4/6 bedroom town House offers a superb interior finish throughout with courtyard Garden and roof terrace.,"£10,950,000",02/10/2018,"Foxtons, South Kensington",https://media.rightmove.co.uk:443/dir/crop/10:9-16:9/16k/15942/71427045/15942_1075215_IMG_01_0000_max_476x317.jpg
11 bedroom house for sale,"Gloucester Place, London, W1U",A freehold investment block consisting of 5 luxury residential apartments located in Marylebone W1. ,"£10,750,000",11/10/2018,"Cluttons, Hyde Park - Sales",https://media.rightmove.co.uk:443/dir/crop/10:9-16:9/57k/56665/67944691/56665_ALB180262_IMG_03_0000_max_476x317.jpg
5 bedroom terraced house for sale,"Thurloe Square, South Kensington, London, SW7","REMOTE & ONLINE VIEWINGS AVAILABLE A grand, grade II listed stucco fronted house in one of London’s most sought after garden squares. Spanning 4,817 square feet and enjoying exceptional ceiling heights throughout the building, this magnificent property offers an incoming purc...","£10,750,000",14/01/2020,"Russell Simpson, Chelsea",https://media.rightmove.co.uk:443/dir/crop/10:9-16:9/47k/46451/67624275/46451_RUS170142_IMG_01_0000_max_476x317.jpg
8 bedroom detached house for sale,"SHELDON AVENUE, KENWOOD, LONDON, N6","Set back from the road behind a gated carriage driveway is this stunning bespoke residence. Built by 'Finkernagel Ross', commissioned by the current owners to create their perfect family home, this incredible house comprises approximately 8247 square feet (766 square metres), over four levels.",POA,31/01/2020,"Marcus Parfitt Residential Sales, London",https://media.rightmove.co.uk:443/dir/crop/10:9-16:9/196k/195101/88988525/195101_SheldJan20Fink_IMG_19_0000_max_476x317.jpg
4 bedroom terraced house for sale,"Horbury Crescent, London W11","The centre of a gently curving crescent in Notting Hill is the setting of this incredible house designed by Stuart Robertson of architects 23 + GS / 318, with interior furnishing and lighting consultancy by Fran Hickman Design. An exquisite example of period renovation, the house on Horbury Cresc...","£10,750,000",22/07/2020,"The Modern House, London",https://media.rightmove.co.uk:443/dir/crop/10:9-16:9/66k/65243/72004047/65243_TMH78115_IMG_01_0002_max_476x317.jpg
5 bedroom house for sale,"Thurloe Square, South Kensington, London, SW7","This magnificent 5 bedroom property spans 4,817 square feet and enjoys exceptional ceiling heights throughout the building with its own private garden, separate terrace and access to Garden Square. ","£10,750,000",06/07/2020,"Chestertons Estate Agents , South Kensington",https://media.rightmove.co.uk:443/dir/crop/10:9-16:9/52k/51955/94470161/51955_SKN200045_IMG_01_0000_max_476x317.jpg
4 bedroom house for sale,"Horbury Crescent, London, W11","Expertly transformed, 23 Architecture and interior designer Fran Hickman joined forces to reimagine and reform this one of a kind four-bedroom Victorian terrace house.","£10,750,000",22/07/2020,"Domus Nova, Notting Hill",https://media.rightmove.co.uk:443/dir/crop/10:9-16:9/29k/28746/95172473/28746_domusnovahorburycrescent_IMG_00_0000_max_476x317.jpg
8 bedroom detached house for sale,"Sheldon Avenue, London, N6","Stunning, detached house in N6 Set back from the road behind a gated carriage driveway is this stunning bespoke residence. Built by 'Finkernagel Ross', commissioned by the current owners to create their perfect family home, this incredible house comprises approximately 8247 squar...",POA,03/02/2020,"Knight Frank, Hampstead",https://media.rightmove.co.uk:443/dir/crop/10:9-16:9/66k/65806/77296432/65806_HAM180071_IMG_01_0000_max_476x317.jpg
3 bedroom apartment for sale,"Chesham Street, SW1X","A stunning three bedroom duplex apartment (2604 sqft /242 sqm) on the ground and lower ground floors of this small discreet block of apartments, newly refurbished to the highest standards and set behind a magnificent white stucco-fronted period building in the heart of Belgravia. The apartment ha...","£10,650,000",30/06/2020,"Harrods Estates, Mayfair",https://media.rightmove.co.uk:443/dir/crop/10:9-16:9/120k/119029/71560296/119029_MFD180031_IMG_02_0000_max_476x317.jpg
5 bedroom end of terrace house for sale,"Ladbroke Terrace, London","Built circa 1833, this handsome five bedroom, end of terrace house has fabulous, lateral entertaining space and further benefits from a passenger lift, a separate self contained flat on the lower ground floor and a wonderful rear garden. ","£10,500,000",10/02/2020,"Strutt & Parker, Notting Hill",https://media.rightmove.co.uk:443/dir/crop/10:9-16:9/81k/80107/68258373/80107_NHL190175_IMG_02_0000_max_476x317.jpg
Land for sale,"The Bishops Avenue, London","A stunning Freehold site with planning consent for a 20,000 sq ft (1,858 sq m) spectacular detached mansion with a magnificent indoor leisure suite including large pool, secure underground parking and elegantly arranged and apportioned reception rooms and bedroom suites, set in grounds of approxi...","£10,500,000",,"Glentree Estates Ltd, London",https://media.rightmove.co.uk:443/dir/crop/10:9-16:9/191k/190037/67523325/190037_29376237_IMG_01_0000_max_476x317.jpg
6 bedroom house for sale,"Battersea House, Battersea Park, 11 Surrey Lane, London, SW11","One of London's hidden gems. An extraordinarily quiet, low built house, situated behind electronically controlled gates and set within a spectacular walled garden, providing the ambience and character of a country house whilst set within central London just moments from the River, Battersea Park...","£10,500,000",10/11/2017,"Russell Simpson, Chelsea",https://media.rightmove.co.uk:443/dir/crop/10:9-16:9/47k/46451/51665268/46451_RUS170168_IMG_01_0000_max_476x317.jpg
8 bedroom flat for sale,"Hyde Park Square, London, W2","Eight bedroom apartment for sale in W2 This sensational apartment is arranged over the first and second floor of a beautiful period terrace on the highly sought after Hyde Park Square. The property features an abundance of space and is very well arranged, offering high ceilings, period de...","£10,500,000",11/09/2019,"Knight Frank, Hyde Park",https://media.rightmove.co.uk:443/dir/crop/10:9-16:9/51k/50634/79261819/50634_HPE190090_IMG_01_0000_max_476x317.jpg
