title,address,description,price,date,seller,image7 bedroom detached house for sale,"Ingram Avenue, NW11","Occupying a wider than average plot on the lower slope of this sought after avenue close to the Heath Extension, a charming and well maintained family home spanning 6903 sq ft (641 sq m) over three storeys. This spacious and handsome home benefits from a large carriage driveway, a south...","£8,500,000",21/05/2018,"Glentree Estates Ltd, London",https://media.rightmove.co.uk:443/dir/crop/10:9-16:9/191k/190037/53318223/190037_27588701_IMG_01_0000_max_476x317.jpg
5 bedroom semi-detached house for sale,"Randolph Road, Little Venice, London W9","A substantial white stucco fronted period house located on one of the finest roads in Little Venice. The property, which is found in stunning condition, backs directly onto arguably one of the finest communal gardens in London, which includes a children's play area and tennis court. The home offe...","£8,500,000",07/07/2020,"Ian Green Residential, London",https://media.rightmove.co.uk:443/dir/crop/10:9-16:9/74k/73947/81830296/73947_29779017_IMG_01_0000_max_476x317.jpg
7 bedroom detached house for sale,"Ingram Avenue, Hampstead Garden Suburb, NW11",Stunning 7 bed house in Hampstead Garden Suburb Occupying a prominent position on Ingram Avenue and featuring a beautiful south facing rear garden with views of a delightful bird sanctuary and private wood is this excellent family home. Occupying a wider than average plot on this incredibly sou...,"£8,500,000",04/10/2019,"Knight Frank, Hampstead",https://media.rightmove.co.uk:443/dir/crop/10:9-16:9/66k/65806/74520229/65806_HAM130103_IMG_01_0003_max_476x317.jpg
4 bedroom apartment for sale,"LONDON HOUSE, AVENUE ROAD, NW8 7PX","An outstanding four bedroom apartment set on the sixth floor of this luxurious sought after portered building on Avenue Road. The flat features a superb 38 sq ft reception room with open and expansive views, which is ideal for entertaining. Further benefits include two terraces, a reserved car pa...","£3,150,000",10/07/2020,"Winkworth, St John's Wood",https://media.rightmove.co.uk:443/dir/crop/10:9-16:9/91k/90830/94660169/90830_2480321_IMG_01_0000_max_476x317.jpg
3 bedroom flat for sale,"Curzon Street, Mayfair, London, W1J","An exceptional 3 bedroom apartment for sale in Mayfair Four newly developed apartments, giving excellent well designed lateral space. All the apartments are presented in immaculate condition with Holly Hunt furniture throughout and Porta Romana lighting, silk curtains, blinds and hand tufted car...","£8,500,000",06/08/2019,"Knight Frank, Mayfair",https://media.rightmove.co.uk:443/dir/crop/10:9-16:9/66k/65815/74937986/65815_WER180060_IMG_12_0001_max_476x317.jpg
4 bedroom flat for sale,"Rose Square, The Bromptons, South Kensington, London, SW3","A 4 bedroom flat for sale in SW3 An immaculately refurbished 4 bedroom apartment in the iconic gated development, Rose Square, comes with 24 hour concierge, security, swimming pool and 2 underground parking spaces. Approximately 298 sq m (3,211 sq ft). EPC: E The Bromptons is a f...","£8,500,000",06/03/2020,"Knight Frank, Knightsbridge",https://media.rightmove.co.uk:443/dir/crop/10:9-16:9/66k/65827/90175274/65827_SLA130356_IMG_01_0001_max_476x317.jpg
2 bedroom apartment for sale,"Whitehall Place,, London, SW1A","A beautifully interior designed lateral apartment of 3,175 square foot situated within the Corinthia Residences, offering unique access to the hotel and all its services.","£8,500,000",29/10/2019,"Wetherell, London",https://media.rightmove.co.uk:443/dir/crop/10:9-16:9/113k/112651/86083856/112651_219469S_IMG_17_0000_max_476x317.jpg
3 bedroom apartment for sale,"Curzon Street, Mayfair, London, W1J","Four newly developed lateral apartments, offering beautifully designed lateral space. VIRTUAL TOUR ","£8,500,000",06/08/2019,"Savills, Mayfair",https://media.rightmove.co.uk:443/dir/crop/10:9-16:9/50k/49602/83477915/49602_MAS180035_IMG_03_0000_max_476x317.jpg
3 bedroom flat for sale,"Burlington Gate, 25 Cork Street, W1S","A stunning 3 bedroom apartment with spa facilities Located in the heart of Mayfair, Burlington Gate provides a selection of galleries and high quality residential apartments within one of the first newly constructed buildings in the area. Moments from the Royal Academy of Arts and Burlington Ar...","£8,500,000",20/05/2020,"Knight Frank, Mayfair",https://media.rightmove.co.uk:443/dir/crop/10:9-16:9/66k/65815/84682004/65815_WER180090_IMG_01_0002_max_476x317.jpg
5 bedroom flat for sale,"HERTFORD STREET,  LONDON,  W1J","4 X 2 bedroom apartments and 1 X 3 bedroom duplex with patio, all recently refurbished located in this charming white stucco period property (with lift) in Mayfair. ","£8,500,000",03/08/2020,"Wedgewood Estates, London",https://media.rightmove.co.uk:443/dir/crop/10:9-16:9/103k/102385/95621477/102385_2561861_IMG_01_0000_max_476x317.jpg
3 bedroom terraced house for sale,"Powis Mews, London, W11","Positioned on a quiet cobbled mews in Notting Hill on the site of a former warehouse, is this extraordinary building that combines an expansive studio space and a split-level apartment, arranged over four floors and measuring almost 5,400 sq ft internally.","£8,500,000",25/05/2018,"The Modern House, London",https://media.rightmove.co.uk:443/dir/crop/10:9-16:9/66k/65243/61022166/65243_4559136_IMG_01_0001_max_476x317.jpg
5 bedroom detached house for sale,"Burghley Road, London, SW19",A substantial and beautifully presented modern detached house in the heart of Wimbledon. A substantial and beautifully presented modern detached house of some 8000 sq ft located in a highly sought after residential road in the heart of Wimbledon. This stunningly built house offers exceptional ...,"£8,500,000",25/06/2020,"Knight Frank, Wimbledon",https://media.rightmove.co.uk:443/dir/crop/10:9-16:9/66k/65833/93999578/65833_WMB012086056_IMG_01_0001_max_476x317.jpg
3 bedroom flat for sale,"Centre Point Residences, 103 New Oxford Street, London, WC1A",3 bedroom apartment with uncompromised views over the city. A beautifully crafted three bedroom apartment within this much sought after recently completed new development part of 'The Vantage Collection'. It is situated on the 27th floor with breath-taking views over London. Centre Point stands...,"£8,450,000",21/11/2019,"Knight Frank - New Homes, Prime Central London Developments",https://media.rightmove.co.uk:443/dir/crop/10:9-16:9/42k/41063/94169942/41063_KRD160991_IMG_01_0000_max_476x317.jpg
Mews house for sale,"Eaton Mews South, Belgravia, London, SW1W","Lateral Mews House in the heart of Belgravia, with flexible accommodation and a roof terrace. Rebuilt in 2012 behind the façade this is an exceptional and completely bespoke mews house measuring 2,991 sq ft of internal space with approximately 823 sq ft of a roof terrace. The house has been cl...","£8,350,000",30/07/2020,"Knight Frank, Belgravia, covering Westminster",https://media.rightmove.co.uk:443/dir/crop/10:9-16:9/95k/94745/82867510/94745_BGV012031072_IMG_01_0002_max_476x317.jpg
4 bedroom apartment for sale,"The Clairmont, The Dumont, SE1","A 1,867 sq ft landscaped terrace with direct river views makes this 18th floor four bedroom apartment one of the most enviable homes in the Dumont. Double doors from the lounge, kitchen and bedrooms open up onto the stunning terrace that has its very own outdoor kitchen and Jacuzzi. The perfect s...",POA,05/12/2019,"JLL, London Residential Developments",https://media.rightmove.co.uk:443/dir/crop/10:9-16:9/101k/100183/71983977/100183_LWN00359_IMG_12_0001_max_476x317.jpg
6 bedroom house for sale,"Springfield Road, St John's Wood, London, NW8 ","A neo-Georgian detached house arranged over 3 floors only, providing 4,316 sq ft / 401 sq m of accommodation and presented in good decorative condition throughout. The house which features elegant and well-proportioned rooms benefits from a large rear garden as well as landscaped gardens to the...","£8,300,000",30/07/2018,"Arlington Residential, London",https://media.rightmove.co.uk:443/dir/crop/10:9-16:9/196k/195398/59514081/195398_28467423_IMG_01_0000_max_476x317.jpg
6 bedroom detached house for sale,"Church Road, Ham, Richmond, TW10",Large-scale accommodation including vast living space and a wonderful indoor swimming pool.,"£8,250,000",10/06/2020,"Hamptons International Sales, Richmond",https://media.rightmove.co.uk:443/dir/crop/10:9-16:9/38k/37955/80726575/37955_RIC200017_IMG_01_0000_max_476x317.jpg
5 bedroom terraced house for sale,"Coleridge Gardens, 552 Kings Road, Kings Chelsea, London, SW10",A rare opportunity to acquire this superb family house which offers excellent accommodation over three floors. The property is one of only eleven houses in this much sought after development and backs onto the communal landscaped gardens. The house has very generous proportions with high ceilings...,"£8,250,000",yesterday,"Susan Metcalfe Residential, London",https://media.rightmove.co.uk:443/dir/crop/10:9-16:9/100k/99512/93867503/99512_1023206824_IMG_07_0000_max_476x317.jpg
4 bedroom flat for sale,"St. James's Street, St. James's, London, SW1A","A Large penthouse comprising two reception rooms, modern eat-in kitchen, private lift and a fantastic south facing terrace looking on to St. James's Palace. ","£8,250,000",18/07/2019,"Chestertons Estate Agents , Mayfair",https://media.rightmove.co.uk:443/dir/crop/10:9-16:9/32k/31623/94931657/31623_MAY170136_IMG_05_0000_max_476x317.jpg
5 bedroom penthouse for sale,"Benbow House, 24 New Globe Walk, Southwark, London, SE1",Exceptional riverside penthouse with incredible City views,"£8,250,000",21/05/2020,"Savills, Waterfront",https://media.rightmove.co.uk:443/dir/crop/10:9-16:9/142k/141689/92541614/141689_WTS200012_IMG_02_0000_max_476x317.jpg
5 bedroom semi-detached house for sale,"Hamilton Terrace, St. John's Wood, London, NW8",This exquisite home has been completely rebuilt behind the original façade to the absolute highest specification on the West Side of this prestigious tree lined boulevard.,"£8,250,000",22/09/2018,"Savills, St John's Wood & Regent's Park",https://media.rightmove.co.uk:443/dir/crop/10:9-16:9/79k/78202/63852843/78202_STS170162_IMG_01_0000_max_476x317.jpg
5 bedroom house for sale,"Hamilton Terrace, London, NW8","Positioned on the west side of this prestigious road, Hamilton Terrace is an impressive semi-detached family home, rebuilt to the highest standard behind the original façade. The interior design of this charming home is exceptional and really showcases the five double bedrooms and ample living sp...","£8,250,000",06/02/2019,"Beauchamp Estates Ltd, Mayfair - Resale",https://media.rightmove.co.uk:443/dir/crop/10:9-16:9/80k/79099/69926611/79099_1009315123_IMG_01_0001_max_476x317.jpg
4 bedroom flat for sale,"St James's Street, St James's, London, SW1A.","4 bed penthouse apartment with roof terrace for sale in St James's SW1 A 4 bedroom triplex penthouse apartment in need of some modernisation, featuring an incredible 27 ft private roof terrace with far reaching views across the London skyline. EPC: E. Comprising 2 flexible open plan reception ...","£8,250,000",28/02/2017,"Knight Frank, Mayfair",https://media.rightmove.co.uk:443/dir/crop/10:9-16:9/66k/65815/40622632/65815_WER030417_IMG_01_0002_max_476x317.jpg
6 bedroom detached house for sale,"Church Road, Ham, Richmond, Surrey, TW10",A remarkable family home within stunning gardens ,"£8,250,000",18/06/2020,"Savills, Richmond",https://media.rightmove.co.uk:443/dir/crop/10:9-16:9/49k/48958/93705887/48958_RIS200022_IMG_01_0000_max_476x317.jpg
5 bedroom semi-detached house for sale,"Hamilton Terrace, St John's Wood, London NW8",This exquisite home has been completely rebuilt behind the original facade to the absolute highest specification on the west side of this prestigious tree lined boulevard. An exceptional opportunity to purchase an impressive semidetached family home. The property has been built to the highest of ...,"£8,250,000",05/02/2019,"Ian Green Residential, London",https://media.rightmove.co.uk:443/dir/crop/10:9-16:9/74k/73947/79141223/73947_28525415_IMG_01_0000_max_476x317.jpg
3 bedroom penthouse for sale,"188 Kirtling St, London. SW8 5NB",Battersea Power Station Duplex Penthouse,"£8,200,000",10/12/2019,"Nest Seekers International , London",https://media.rightmove.co.uk:443/dir/crop/10:9-16:9/193k/192446/89178887/192446_NEST_RM_192446_1278012_IMG_11_0000_max_476x317.jpg
3 bedroom apartment for sale,"Boiler House Square, Battersea Power Station, Nine Elms, London, SW8","A truly sensational three bedroom duplex apartment in Boiler House Square, the exclusive penthouse level of the Battersea Power Station development. This apartment is an astonishing 2381 square foot of flexible living space with a stunning roof terrace in one of the most iconic buildings in Centr...","£8,150,000",11/09/2019,"MyLondonHome, Battersea",https://media.rightmove.co.uk:443/dir/crop/10:9-16:9/220k/219590/67988691/219590_NSN150102_IMG_01_0000_max_476x317.jpg
3 bedroom penthouse for sale,"The Boiler House, Battersea Power Station, Battersea, SW8","*Exclusive Penthouse* One of only four Chimney Penthouses in the scheme. Premier specification three bedroom four bathroom apartment spread over (2,381 Sq. Ft internal) plus (992 Sq .Ft roof terrace) and a further unique (302 Sq. Ft) Wrap around Chimney Terrace, offering panoramic Chelsea Bridge,...","£8,150,000",03/09/2018,"Ernest-Brooks International, London",https://media.rightmove.co.uk:443/dir/crop/10:9-16:9/163k/162914/63617661/162914_CAN170525_IMG_06_0000_max_476x317.jpg
2 bedroom flat for sale,"Otter Drive, Carshalton, Surrey","The Personal Agent are delighted to present this beautifully finished apartment set in a popular part of Carshalton. Located in a development built within the last 8 years, the property boasts a perfect example of modern and contemporary living. This larger than average apartment, measuring 782...","£300,000",07/08/2020,"The Personal Agent, Banstead",https://media.rightmove.co.uk:443/dir/crop/10:9-16:9/150k/149105/95527850/149105_29864725_IMG_01_0000_max_476x317.jpg
4 bedroom penthouse for sale,"Battersea Power Station, Nine Elms, London SW8","Opportunity to acquire, one of the very few duplex villa / townhouse style apartment set on top of the boiler square of the Battersea Power Station which is currently being restored. This 3 bedroom, 4 bathroom home offers generous amount of outdoor space.","£8,150,000",14/02/2020,"Copperstones Ltd, London",https://media.rightmove.co.uk:443/dir/crop/10:9-16:9/83k/82091/77495212/82091_CS_118_IMG_10_0000_max_476x317.jpg
3 bedroom apartment for sale,"Marylebone Square, London, W1U","A 4th floor, three bedroom penthouse apartment set within this most eagerly awaited residential development to be built in Marylebone over recent decades. Nestled in the absolute epicentre of Marylebone Village only a stone's throw from the much lauded and admired Marylebone High Stree...","£8,110,000",02/03/2020,"Druce Marylebone Ltd, London",https://media.rightmove.co.uk:443/dir/crop/10:9-16:9/94k/93215/68775510/93215_MAS200011_IMG_01_0000_max_476x317.jpg
3 bedroom flat for sale,"Aybrook Street, Marylebone, London, W1U ","A fabulous three bedroom penthouse in a development currently under construction in the heart of Marylebone. The flat contains a large reception room, open-plan kitchen and three bedrooms with ensuite bathrooms. High-quality, natural materials such as oak flooring, bronze-coated windows and stone...","£8,110,000",13/07/2020,"Arlington Residential, London",https://media.rightmove.co.uk:443/dir/crop/10:9-16:9/196k/195398/71814960/195398_29795580_IMG_01_0000_max_476x317.jpg
3 bedroom flat for sale,"Marylebone Square, London, London, W1U ","A stunning three bedroom penthouse apartment with a study situated on the fourth floor of a brand new development boasting contemporary high-specification finishes throughout and a private Balcony. The development offers a collection of one, two and three bedroom apartments boasting contemporary ...","£8,110,000",13/05/2020,"Hanover, St John's Wood",https://media.rightmove.co.uk:443/dir/crop/10:9-16:9/75k/74440/70466379/74440_29631276_IMG_01_0000_max_476x317.jpg
3 bedroom flat for sale,"Marylebone Square, Moxon Street, London, W1U","Located within this exquisite, contemporary and highly anticipated luxury new build development is this magnificent 3 bedroom, fourth floor Penthouse apartment with terrace. Marylebone Square offers the highest standard of finishes and specifications combining the finest blend of modern fi...","£8,110,000",22/06/2020,"Behr and Butchoff, St John's Wood",https://media.rightmove.co.uk:443/dir/crop/10:9-16:9/79k/78397/93867716/78397_SJW200098_IMG_01_0000_max_476x317.jpg
3 bedroom penthouse for sale,"Moxon Street, London, W1U","Marylebone Square is a collection of 54 high-end apartments, carefully chosen boutiques and restaurants, and a versatile community hall.","£8,110,000",07/04/2020,"Carter Jonas, Marylebone",https://media.rightmove.co.uk:443/dir/crop/10:9-16:9/49k/48576/91185314/48576_MYL200041_IMG_01_0000_max_476x317.jpg
3 bedroom apartment for sale,"Marylebone Square, Marylebone, London","A contemporary take on a classic London mansion, Marylebone Square has been designed by Simon Bowden Architecture and with interiors by LIV Interiors. Home to 54 apartments and carefully selected boutiques and restaurants, it offers the very best of a refined London village lifestyle. Bound by Ay...","£8,110,000",07/04/2020,"Ian Green Residential, London",https://media.rightmove.co.uk:443/dir/crop/10:9-16:9/74k/73947/78750709/73947_29596928_IMG_07_0000_max_476x317.jpg
4 bedroom apartment for sale,"Knightsbridge, London","A grand lateral apartment situated on the fourth floor of Parkside, one of the most imposing apartment blocks in Knightsbridge backing directly onto Hyde Park with views across the park from the main rooms and balcony. The apartment is fully air-conditioned having obtained special consent for it...","£8,100,000",24/01/2019,"Hyde Park Agencies, London",https://media.rightmove.co.uk:443/dir/crop/10:9-16:9/78k/77287/74792867/77287_28083973_IMG_11_0000_max_476x317.jpg
3 bedroom apartment for sale,"Boiler House, Battersea Power Station",The Height of Luxury Living | *Stunning Penthouse Apartment* | Part of The Original Chimney Stack | Battersea Power Station,"£8,100,000",03/07/2020,"Invest & Co, London",https://media.rightmove.co.uk:443/dir/crop/10:9-16:9/220k/219485/94205924/219485_103426000011_IMG_01_0000_max_476x317.jpg
5 bedroom detached house for sale,"Hamilton Terrace, London, NW8","Development opportunity, impressive, detached, period, freehold villa with large rear garden. A substantial residence on this highly sought-after tree-lined road. The property is being sold with planning permission to create a spectacular family home with a large indoor leisure complex and a 170...","£8,000,000",03/08/2020,"Knight Frank, St John's Wood",https://media.rightmove.co.uk:443/dir/crop/10:9-16:9/66k/65830/77305903/65830_SJW190150_IMG_01_0001_max_476x317.jpg
3 bedroom flat for sale,"Rutland Court, Rutland Gardens, Knightsbridge, London, SW7","A 3 bedroom flat for sale in Knightsbridge SW7 A beautiful three bedroom raised ground floor apartment on a private road. The flat benefits from a porter and parking (by separate negotiation). Approximately 209.6 sq m (2,256 sq ft). EPC D This grand and spacious lateral apartment is situated ...","£8,000,000",30/10/2019,"Knight Frank, Knightsbridge",https://media.rightmove.co.uk:443/dir/crop/10:9-16:9/66k/65827/83050274/65827_SLA180252_IMG_01_0001_max_476x317.jpg
5 bedroom terraced house for sale,"Argyll Road, London, W8","An elegant five bedroom family house with a 63ft garden ideally situated on the Phillimore Estate Set back from the street, the house is approached via a front garden with a beautiful silver birch tree and steps up to an impressive front door. A spacious entrance hall on the raised ground floor...","£8,000,000",10/07/2020,"Knight Frank, Kensington",https://media.rightmove.co.uk:443/dir/crop/10:9-16:9/66k/65809/94658576/65809_KEN012089692_IMG_01_0000_max_476x317.jpg
8 bedroom house for sale,"Heath Drive, Hampstead, NW3","Set on a secluded 1/3 of an acre site, a substantial (6,787 sq ft / 630 sq m) and elegant double fronted six bedroom, detached house set back from the road behind its own a carriage driveway and remote security gates. This handsome home provides extensive entertaining space on the groun...","£8,000,000",23/07/2020,"TK International, Hampstead",https://media.rightmove.co.uk:443/dir/crop/10:9-16:9/67k/66289/72031722/66289_29833834_IMG_01_0000_max_476x317.jpg
3 bedroom apartment for sale,"Rutland Court, Rutland Gardens, London, SW7",A beautiful three bedroom raised ground floor apartment on a private road. The flat benefits from a porter and parking (by separate negotiation). This grand and spacious lateral apartment is situated on the raised ground floor of a prestigious apartment block in Knightsbridge. ,"£8,000,000",30/10/2019,"Russell Simpson, Chelsea",https://media.rightmove.co.uk:443/dir/crop/10:9-16:9/47k/46451/66061920/46451_RUS190253_IMG_01_0000_max_476x317.jpg
3 bedroom flat for sale,"Pembridge Crescent, Notting Hill, London, W11","Exceptional 3 bedroom apartment for sale in Notting Hill, W11 An exceptional newly refurbished three bedroom apartment with direct lift access, offering wonderful lateral space set over two floors of this this elegant double fronted detached villa. Arranged over the second and third floors (wit...","£8,000,000",09/07/2020,"Knight Frank, Notting Hill",https://media.rightmove.co.uk:443/dir/crop/10:9-16:9/66k/65821/94607795/65821_NGH180061_IMG_01_0000_max_476x317.jpg
6 bedroom house for sale,"Totteridge Common, Totteridge, London","Situated in a highly sought after location in the heart of Totteridge Common, Long Pond House is set within 2 acres of the most beautiful south facing landscaped gardens and offers superb living accommodation arranged over 3 floors. This wonderfully secluded house benefits from bright, spacious ...",POA,18/02/2020,"Statons, Totteridge",https://media.rightmove.co.uk:443/dir/crop/10:9-16:9/23k/22317/77595436/22317_29490128_IMG_01_0000_max_476x317.jpg
4 bedroom apartment for sale,"Knightsbridge, SW1X","A Fully Refurbished, Interior Designed Four Bedrooms, Five Bathrooms Lateral Apartment, With A Large Outdoor Terrace Overlooking Hyde Park (2,202 Sq Ft / 204.6 Sq Meters).  ","£8,000,000",25/05/2018,"Knightsbridge, Estate Agents",https://media.rightmove.co.uk:443/dir/crop/10:9-16:9/112k/111955/65481997/111955_331_IMG_19_0000_max_476x317.jpg
8 bedroom detached house for sale,"Parkside, Wimbledon Village, SW19","Situated in an enviable position on Parkside on the edge of Wimbledon Village and directly overlooking the Common, this dignified Edwardian family house offers bright, spacious and versatile accommodation less than 500 metres from the bustling High Street",POA,24/07/2020,"Robert Holmes & Co, Wimbledon - Sales",https://media.rightmove.co.uk:443/dir/crop/10:9-16:9/73k/72698/82649842/72698_WIM180043_IMG_01_0000_max_476x317.jpg
13 bedroom terraced house for sale,"Prince of Wales Terrace, London, W8","**DEVELOPMENT OPPORTUNITY A substantial six storey buildings requiring full renovation. Approximately 5700 sq ft, this wonderful property offers true scope and potential and are situated a short distance from Kensington Gardens. Previously the building was a trading as a hotel.",POA,25/04/2020,"Hamptons International Sales, Kensington",https://media.rightmove.co.uk:443/dir/crop/10:9-16:9/38k/37922/91657883/37922_KEN190051_IMG_01_0000_max_476x317.jpg
7 bedroom detached house for sale,"Heath Drive, Hampstead","Set on a secluded site of 1/3 of an acre, a substantial (6,787 sq ft) and elegant double fronted six bedroom detached house set back from the road behind its own carriage driveway and electronic security gates. This handsome home provides extensive entertaining space on the ground floor with four...","£8,000,000",23/07/2020,"Goldschmidt & Howland, Hampstead - Sales",https://media.rightmove.co.uk:443/dir/crop/10:9-16:9/88k/87916/72041262/87916_HAM060030_IMG_14_0000_max_476x317.jpg
6 bedroom detached house for sale,"Marlborough Place, St John's Wood",Fantastic opportunity to purchase this Freehold six bedroom detached house located in St. John's Wood.,"£8,000,000",21/03/2019,"The Cloister, London",https://media.rightmove.co.uk:443/dir/crop/10:9-16:9/52k/51305/94223252/51305_5097_IMG_01_0000_max_476x317.jpg
4 bedroom apartment for sale,"Lensbury Avenue, London, SW6","This breathtaking penthouse apartment benefits from 360 degree views over London, eat in kitchen, three reception rooms, 4 bedrooms, 4 bathrooms also offering an abundance of terracing and high specification fittings throughout.","£7,995,000",27/02/2020,"Breteuil, Fulham",https://media.rightmove.co.uk:443/dir/crop/10:9-16:9/184k/183611/63803301/183611_198769S_IMG_26_0000_max_476x317.jpg
6 bedroom terraced house for sale,"Old Brompton Road, Kensington, London, SW5","A wonderfully proportioned, substantial family home, intelligently designed with access to a private communal garden within the Boltons Conservation Area. The property offers magnificent reception space, with an elegant first floor drawing room and a generous ground floor kitchen/breakfast room, ...","£7,995,000",07/02/2020,"Barnes International Realty, London",https://media.rightmove.co.uk:443/dir/crop/10:9-16:9/177k/176336/92965454/176336_BAI180207_IMG_01_0000_max_476x317.jpg
