title,address,description,price,date,seller,image7 bedroom detached house for sale,"Home Park Road, Wimbledon, SW19",A substantial detached family home located in a sought after road overlooking the open spaces of Wimbledon Park with its lake and golf course and close to its additional amenities of tennis courts and playgrounds. Wimbledon Park shops and District Line station are within a short walk,"£6,750,000",19/05/2020,"Robert Holmes & Co, Wimbledon - Sales",https://media.rightmove.co.uk:443/dir/crop/10:9-16:9/73k/72698/79863358/72698_WIM200055_IMG_01_0000_max_476x317.jpg
7 bedroom detached house for sale,"Coombe Hill Road, Kingston upon Thames, Surrey, KT2","A stunning seven bedroom family home offered in immaculate order within private secluded grounds of half an acre with a spacious kitchen/dining/family/study room, formal drawing room, study/dining room, gym, five bathroom/shower rooms, two ensuites, double garage and off street parking.","£6,750,000",17/01/2020,"Coombe Residential, Wimbledon",https://media.rightmove.co.uk:443/dir/crop/10:9-16:9/47k/46562/88460456/46562_WIM160159_IMG_01_0000_max_476x317.jpg
4 bedroom flat for sale,Pont Street Knightsbridge SW1X,"An unusually large, south-facing first floor flat, with lift, set within this imposing period building which has a wide entrance hall, with original staircase leading up to the flat. The property was originally two flats and was amalgamated some years ago, now offering over 2,300 sq ft / 213 sq ...","£6,750,000",18/02/2020,"JLL, Chelsea",https://media.rightmove.co.uk:443/dir/crop/10:9-16:9/213k/212339/70881468/212339_P103005_IMG_01_0000_max_476x317.jpg
6 bedroom detached house for sale,"Woodview, Warren Road, Kingston upon Thames, London, Surrey","An impressive detached house on one of the most prestigious roads on the Coombe estate in Kingston upon Thames. This private road is home to some of the finest houses in the county, and Woodview is one of its most spectacular, finished to the highest standard and spanning over 8500 sq ft. ","£6,750,000",28/01/2020,"Fine & Country, West London",https://media.rightmove.co.uk:443/dir/crop/10:9-16:9/205k/204377/88831769/204377_29427745_IMG_07_0000_max_476x317.jpg
6 bedroom detached house for sale,Hampstead NW3,"Heathgate is delighted to offer for sale this recently constructed, impressive, interior designed villa which spans approximately 5,362 sq ft (494","£6,750,000",15/05/2020,"Heathgate, London",https://media.rightmove.co.uk:443/dir/crop/10:9-16:9/52k/51753/92281646/51753_39606_IMG_01_0000_max_476x317.jpg
6 bedroom detached house for sale,Hampstead NW3,"Heathgate is delighted to offer for sale, this recently constructed, impressive, interior designed villa which spans approximately 5,362 sq ft (494","£6,750,000",10/01/2020,"Heathgate, London",https://media.rightmove.co.uk:443/dir/crop/10:9-16:9/52k/51753/88226543/51753_38068_IMG_01_0000_max_476x317.jpg
4 bedroom terraced house for sale,"St Leonards Terrace, Chelsea, London, SW3",REMOTE & ONLINE VIEWINGS AVAILABLE A magnificent Chelsea house in one of London’s most sought after addresses with open southerly views across Burton Court towards Christopher Wren’s Royal Hospital. This Grade II Listed Freehold house is one of very few to have the rare...,"£6,750,000",30/06/2020,"Russell Simpson, Chelsea",https://media.rightmove.co.uk:443/dir/crop/10:9-16:9/47k/46451/71547210/46451_RUS160064_IMG_14_0000_max_476x317.jpg
5 bedroom terraced house for sale,"South Terrace, London, SW7",A charming and spacious Grade II listed family townhouse with access to Thurloe Square Gardens.,"£6,750,000",09/02/2020,"Savills, Sloane Street",https://media.rightmove.co.uk:443/dir/crop/10:9-16:9/49k/48943/80193139/48943_KNH200010_IMG_01_0000_max_476x317.jpg
5 bedroom apartment for sale,"Orchard Court, Portman Square","An immaculately presented and exceptionally well refurbished 5 bedroom apartment on the 2nd floor of one of London's finest purpose built blocks. This lateral apartments showcases 2,566 sq ft / 239 sq m of living accommodation. Comprising from exceptional entertaining space with a spacious ...","£6,750,000",13/06/2019,"Manors, London - Sales",https://media.rightmove.co.uk:443/dir/crop/10:9-16:9/86k/85331/63007662/85331_BAK160138_IMG_01_0000_max_476x317.jpg
2 bedroom apartment for sale,"Ebury Street, London, SW1W","This charming apartment, located in the heart of Belgravia, has undergone extensive refurbishment and is offered for sale in immaculate condition.","£1,750,000",29/05/2020,"Tedworth Property Limited, London",https://media.rightmove.co.uk:443/dir/crop/10:9-16:9/183k/182369/70785981/182369_LND200070_IMG_01_0000_max_476x317.jpg
4 bedroom house for sale,"Alexander Place, South Kensington, London",A beautiful Grade II listed four-bedroom Georgian terraced Townhouse situated on one of Knightsbridge's most revered roads.,"£6,750,000",12/06/2020,"Strutt & Parker, South Kensington",https://media.rightmove.co.uk:443/dir/crop/10:9-16:9/155k/154907/80853574/154907_SOK190065_IMG_03_0000_max_476x317.jpg
3 bedroom flat for sale,"Eaton Place, Belgravia, London, SW1X","A superb lateral apartment in Eaton Place, Belgravia SW1 Arranged laterally over the second floor of a white stucco-fronted building, this exceptional apartment covers approximately 224 sq m (2,414 sq ft). The property benefits from direct lift access and a separate basement room which could be ...","£6,750,000",29/05/2020,"Knight Frank, Belgravia, covering Westminster",https://media.rightmove.co.uk:443/dir/crop/10:9-16:9/95k/94745/80269780/94745_BGV190016_IMG_01_0000_max_476x317.jpg
7 bedroom detached house for sale,"Home Park Road, Wimbledon, London, SW19","PRESTIGIOUS 7 BED GATED RESIDENCE APPROACHING 7,000 Sq ft - A stunning, bespoke designed private gated residence in arguably one of Wimbledons most sought after residential avenues. Offering lavish accommodation over 4 floors, this stunning property further boasts impressive landscaped gardens","£6,750,000",04/07/2020,"Greenfield & Company, Ewell",https://media.rightmove.co.uk:443/dir/crop/10:9-16:9/59k/58022/94413200/58022_792_IMG_01_0000_max_476x317.jpg
2 bedroom flat for sale,"One Kensington Gardens, Kensington Road, London W8",Exceptional two bedroom apartment on the third floor of this stunning development on De Vere Gardens ,"£6,700,000",15/04/2020,"Strutt & Parker, London - New Homes",https://media.rightmove.co.uk:443/dir/crop/10:9-16:9/97k/96919/78938233/96919_LNW200029_IMG_01_0000_max_476x317.jpg
3 bedroom apartment for sale,"Marylebone Square, Moxon St, W1U","Marylebone Square is one of London's most sought after locations, 54 private lateral apartments self contained within a beautifully designed building.","£6,675,000",25/04/2020,"Savills New Homes, Margaret Street",https://media.rightmove.co.uk:443/dir/crop/10:9-16:9/49k/48985/79160131/48985_LAD181337_IMG_02_0000_max_476x317.jpg
3 bedroom flat for sale,"Aybrook Street, Marylebone, London, W1U ","A fabulous three bedroom apartment in a development currently under construction in the heart of Marylebone. The flat contains a large reception room, open-plan kitchen and three bedrooms with ensuite bathrooms. High-quality, natural materials such as oak flooring, bronze-coated windows and stone...","£6,660,000",13/07/2020,"Arlington Residential, London",https://media.rightmove.co.uk:443/dir/crop/10:9-16:9/196k/195398/71814957/195398_29795579_IMG_01_0000_max_476x317.jpg
3 bedroom apartment for sale,"Moxon Street, London, W1U","Marylebone Square is a collection of 54 high-end apartments, carefully chosen boutiques and restaurants, and a versatile community hall.","£6,660,000",21/01/2020,"Carter Jonas, Marylebone",https://media.rightmove.co.uk:443/dir/crop/10:9-16:9/49k/48576/88621754/48576_MYL200013_IMG_01_0000_max_476x317.jpg
3 bedroom flat for sale,"Marylebone Square, London, London, W1U ","A stunning three bedroom apartment situated on the second floor of a brand new development boasting contemporary high-specification finishes throughout and a private Balcony. The development offers a collection of one, two and three bedroom apartments boasting contemporary high-specification inte...","£6,660,000",13/05/2020,"Hanover, St John's Wood",https://media.rightmove.co.uk:443/dir/crop/10:9-16:9/75k/74440/70466367/74440_29631271_IMG_01_0000_max_476x317.jpg
3 bedroom flat for sale,"Moxon Street, W1U","Marylebone Square is a collection of 54 high-end apartments, carefully chosen boutiques and restaurants and a versatile Community Hall.","£6,660,000",18/10/2019,"Douglas & Gordon, Gloucester Road",https://media.rightmove.co.uk:443/dir/crop/10:9-16:9/35k/34295/74869600/34295_X67326_1_IMG_01_0000_max_476x317.jpg
3 bedroom flat for sale,"Marylebone Square, Moxon Street, London, W1U","Located within this exquisite, contemporary and highly anticipated luxury new build development is this magnificent 3 bedroom, second floor apartment with balcony. Marylebone Square offers the highest standard of finishes and specifications combining the finest blend of modern fixtures and...","£6,660,000",22/06/2020,"Behr and Butchoff, St John's Wood",https://media.rightmove.co.uk:443/dir/crop/10:9-16:9/79k/78397/93867707/78397_SJW200095_IMG_01_0000_max_476x317.jpg
3 bedroom apartment for sale,"Marylebone Square, Marylebone",Three bedroom apartment available on the second floor.,"£6,660,000",19/11/2019,"The Cloister, London",https://media.rightmove.co.uk:443/dir/crop/10:9-16:9/52k/51305/94228733/51305_5672_IMG_01_0000_max_476x317.jpeg
3 bedroom apartment for sale,"Moxon Street, Marylebone Square, Marylebone, W1U","Marylebone Square is a collection of 54 high-end apartments, carefully chosen boutiques and restaurants and a versatile Community Hall. ","£6,660,000",28/02/2020,"Quinta Estates, London",https://media.rightmove.co.uk:443/dir/crop/10:9-16:9/192k/191678/68702142/191678_CAE200094_IMG_01_0000_max_476x317.jpg
3 bedroom flat for sale,"Green Street, Mayfair, London, W1K","A grand 3 bedroom apartment with impressive views over The Secret Gardens of Green Street. A beautiful 3 bedroom duplex apartment on one of Mayfair's premier streets. Behind a traditional period red brick facade, this high specification apartment on the first and second floors boasts views over...","£6,660,000",29/05/2020,"Knight Frank, Mayfair",https://media.rightmove.co.uk:443/dir/crop/10:9-16:9/66k/65815/92877065/65815_WER130145_IMG_01_0000_max_476x317.jpg
3 bedroom apartment for sale,"Moxon Street, London, W1U","A second floor, west facing three bedroom apartment with a separate study set within this most eagerly awaited residential development to be built in the heart of Marylebone Village. Marylebone Square is a rare opportunity to be part of the provenance of aristocratic estates in Central London....","£6,660,000",22/10/2019,"Beauchamp Estates, London",https://media.rightmove.co.uk:443/dir/crop/10:9-16:9/184k/183887/75658666/183887_1018617635_IMG_01_0001_max_476x317.jpg
3 bedroom property for sale,"Marylebone Square, Moxon Street","A second floor, west facing three bedroom apartment with a separate study set within this most eagerly awaited residential development to be built in the heart of Marylebone Village. Marylebone Square is a rare opportunity to be part of the provenance of aristocratic estates in Central...","£6,660,000",23/10/2019,"Manors, London - Sales",https://media.rightmove.co.uk:443/dir/crop/10:9-16:9/86k/85331/65947641/85331_BAK190771_IMG_01_0000_max_476x317.jpg
3 bedroom property for sale,"Moxon Street, London, W1U",A North-West facing three-bedroom apartment set in a brand new development in the heart of Marylebone. ,"£6,660,000",09/03/2020,"Robert Irving & Burns, London",https://media.rightmove.co.uk:443/dir/crop/10:9-16:9/76k/75301/78061693/75301_RIB200052_IMG_05_0000_max_476x317.jpg
3 bedroom apartment for sale,"Marylebone Square, Marylebone, London, W1U","A 3 bedroom corner apartment with dual aspect and balcony, located on the 2nd floor located in one of Marylebone's finest and most exciting new developments available for sale.","£6,660,000",16/01/2020,"Jaffray Estates, London",https://media.rightmove.co.uk:443/dir/crop/10:9-16:9/70k/69492/88446734/69492_A213_IMG_00_0000_max_476x317.jpg
4 bedroom terraced house for sale,"Cresswell Place, London, SW10",Fabulous family home.,"£6,650,000",03/03/2020,"Savills, Chelsea",https://media.rightmove.co.uk:443/dir/crop/10:9-16:9/79k/78262/63846651/78262_CES190015_IMG_09_0000_max_476x317.jpg
4 bedroom flat for sale,"Harbour Avenue,
London,
SW10",Quite simply one of the most special lateral apartments on the market today. Flooded with natural light. Viewing is essential to appreciate the merits of this beautiful apartment.,"£6,650,000",08/07/2020,Chelsea Island Developments Ltd,https://media.rightmove.co.uk:443/dir/crop/10:9-16:9/224k/223973/94581902/223973_B44B55_IMG_10_0000_max_476x317.jpg
5 bedroom terraced house for sale,"Wilton Place, London, SW1X",A well-presented and meticulously designed five bedroom Georgian townhouse in this prime and much sought after Belgravia location.,"£6,600,000",22/06/2020,"Winkworth, Knightsbridge & Chelsea",https://media.rightmove.co.uk:443/dir/crop/10:9-16:9/59k/58654/82259920/58654_KBR200033_IMG_01_0000_max_476x317.jpg
4 bedroom terraced house for sale,"Eaton Mews South, Belgravia, London, SW1W","An elegant and modernised mews house with 1st floor reception rooms, well appointed bedrooms and a media room in the lower floor. A large roof terrace gives welcome outside space. Parking to the front is private via a Grosvenor permit. Use of the communal gardens at Belgrave Square is b...","£6,600,000",29/06/2020,"The London Broker, Mayfair",https://media.rightmove.co.uk:443/dir/crop/10:9-16:9/175k/174521/94187291/174521_WIL200001_IMG_01_0000_max_476x317.jpg
3 bedroom penthouse for sale,"Marylebone Lane, Marylebone, W1U","Take in London's skyline from the comfort of your own living room at Marylebone Square, the perfect home for those looking for high-quality living in a comfortable environment.","£6,600,000",05/12/2019,"Portico, Bloomsbury",https://media.rightmove.co.uk:443/dir/crop/10:9-16:9/67k/66944/87255215/66944_S56564_IMG_01_0000_max_476x317.jpg
5 bedroom house for sale,"Eaton Terrace, London, SW1W","A bright and attractively presented, stucco fronted, family house constructed over ground, lower ground and four upper floors and benefiting from a terrace. Planning permission has been granted by the Royal Borough of Kensington & Chelsea to extend the house to some 3,700 square feet (PP/14/0...","£6,550,000",26/09/2018,"Beauchamp Estates, London",https://media.rightmove.co.uk:443/dir/crop/10:9-16:9/184k/183887/67707919/183887_1001176837_IMG_13_0000_max_476x317.png
13 bedroom end of terrace house for sale,"Alexander Street, Notting Hill, London, W2","Comprising six separate two and three bedroom apartments, this is an attractive freehold building on a tree-lined street close to shops, cafes and restaurants of Westbourne Grove.",POA,03/08/2020,"Tedworth Property Limited, London",https://media.rightmove.co.uk:443/dir/crop/10:9-16:9/183k/182369/72260295/182369_LND200073_IMG_01_0000_max_476x317.jpg
2 bedroom flat for sale,"High Road, East Finchley, London, N2","A fantastic 2 bedroom 1st floor flat, which provides spacious and naturally bright interiors, offering a large reception room, a separate kitchen and benefits 2 well-proportioned double bedrooms.","£375,000",yesterday,"Foxtons, Crouch End",https://media.rightmove.co.uk:443/dir/crop/10:9-16:9/85k/84073/82253803/84073_1139716_IMG_03_0000_max_476x317.jpg
Property for sale,"Riverdale Gardens, St Margarets, Twickenham, TW1","• Three charming Edwardian freehold buildings situated in St Margarets, Twickenham within the London Borough of Richmond. • The properties are arranged as three semi-detached blocks, currently configured as 24 self contained apartments, arranged over ground to second floors w...","£6,500,000",10/03/2020,"Cushman & Wakefield, London",https://media.rightmove.co.uk:443/dir/crop/10:9-16:9/52k/51570/78091723/51570_LON200069_IMG_01_0000_max_476x317.jpg
House for sale,"70-76 Bell Street, London, Greater London, NW1","The units comprise of four terraced houses spread across basement, ground, first and second floors. They are all of a similar specification and layout comprising of three bedrooms with two bathrooms and a small outdoor terrace.","£6,500,000",27/02/2020,"Lambert Smith Hampton, London",https://media.rightmove.co.uk:443/dir/crop/10:9-16:9/183k/182516/89892638/182516_2045802FH_IMG_01_0000_max_476x317.jpg
7 bedroom semi-detached house for sale,"Hampton Court Road, East Molesley, Richmond, KT8","An exciting opportunity to acquire this Grade II listed property dating back to 1743. Having been meticulously refurbished throughout by the current owners, the property offers contemporary living whilst retaining the many of the fabulous features of this family home. Originally built for the Kin...","£6,500,000",12/06/2020,"Fine & Country, Richmond",https://media.rightmove.co.uk:443/dir/crop/10:9-16:9/219k/218669/71115087/218669_RAK200191_IMG_01_0000_max_476x317.jpg
5 bedroom penthouse for sale,"Chelsea Harbour, Chelsea, London, SW10","Featuring ample living and entertaining space, this superb five bedroom penthouse apartment offers stylish riverside accommodation in Chelsea Harbour.","£6,500,000",18/07/2019,"Foxtons, South Kensington",https://media.rightmove.co.uk:443/dir/crop/10:9-16:9/16k/15942/70089696/15942_1108201_IMG_01_0000_max_476x317.jpg
3 bedroom apartment for sale,"Park Lane, W1K","A beautifully presented three bedroom apartment (2,897sq ft / 269.1sq m) on one of London’s most prestigious streets. In brief, this outstanding apartment comprises a grand entrance hall, large kitchen fully equipped with Miele appliances, voluminous reception room with French Doors leadin...","£6,500,000",06/01/2020,"Harrods Estates, Mayfair",https://media.rightmove.co.uk:443/dir/crop/10:9-16:9/120k/119029/67461816/119029_MAY110046_IMG_01_0000_max_476x317.jpg
6 bedroom detached house for sale,"Beech Hill, Hadley Wood, Hertfordshire, EN4",A stunning mansion on the area's premier road featuring a spectacular indoor swimming pool complex and south facing gardens backing directly onto Hadley Wood Golf Course.,"£6,500,000",09/03/2020,"Savills, Country Department",https://media.rightmove.co.uk:443/dir/crop/10:9-16:9/49k/48982/90253847/48982_LAC200041_IMG_01_0000_max_476x317.jpg
4 bedroom terraced house for sale,"Trevor Square, Knightsbridge SW7",A handsome Grade II listed townhouse situated in this prime Knightsbridge Garden Square. ,"£6,500,000",08/10/2019,"Nicolas Van Patrick, Knightsbridge",https://media.rightmove.co.uk:443/dir/crop/10:9-16:9/190k/189221/74630992/189221_101492005214_IMG_01_0000_max_476x317.jpg
3 bedroom apartment for sale,"St Edmunds Terrace, London, NW8","A beautifully presented apartment finished to a high specification situated on the 2nd floor of this prestigious development designed by the internationally renowned architects Squire and Partner. The apartment has 3 bedrooms all with en suite facilities, an impressive double reception room. The ...","£6,500,000",29/05/2020,"Laurence Leigh Residential , London - Sales",https://media.rightmove.co.uk:443/dir/crop/10:9-16:9/76k/75150/70787250/75150_LLR200028_IMG_03_0000_max_476x317.jpg
3 bedroom apartment for sale,"Marylebone Square, Moxon Street, Marylebone, W1","Marylebone Square Is A Brand New Luxury Development Of 54 High-End Homes, Including 12 Penthouses. Large Three Bedrooms, Four Bathrooms Apartment, Spanning 1,938 Sq Ft (180 Sq Meters) with a 104 Sq Ft (10.0 Sq Meters) West Facing Balcony.","£6,500,000",27/02/2020,"Knightsbridge, Estate Agents",https://media.rightmove.co.uk:443/dir/crop/10:9-16:9/112k/111955/77770780/111955_762_IMG_01_0000_max_476x317.jpg
6 bedroom terraced house for sale,"Elm Row, Hampstead, NW3","An exceptional six bedroom Grade II Listed Georgian house, circa 1720 (3,900 Sq Ft - 362 Sq M), with a garage, an outbuilding & a south facing walled garden; set in a discreet Hampstead Village location.","£6,500,000",30/01/2019,"Amberden Estates, Hampstead",https://media.rightmove.co.uk:443/dir/crop/10:9-16:9/91k/90643/78984818/90643_Ambhj77ty543_IMG_00_0000_max_476x317.jpg
4 bedroom apartment for sale,"Albert Hall Mansions, Kensington Gore, London, SW7",VIDEO TOUR AVAILABLE - A wonderful four bedroom lateral apartment with stunning views over Hyde Park and the Albert Memorial.,"£6,500,000",20/02/2019,"Cluttons, Hyde Park - Sales",https://media.rightmove.co.uk:443/dir/crop/10:9-16:9/57k/56665/62393908/56665_ALB160080_IMG_15_0000_max_476x317.jpg
2 bedroom house for sale,"Holland Street, London, W8","A newly built house by SPINK Architects incorporating an extremely high level of detail & specification. The SPINK design is elegantly understated & subtle, rich with materials and craft. A combination of new build construction, with a sun trap private garden and off street parking.","£6,500,000",22/07/2020,"Alexander Millett , London",https://media.rightmove.co.uk:443/dir/crop/10:9-16:9/215k/214526/85027157/214526_Holland_IMG_20_0000_max_476x317.jpg
4 bedroom apartment for sale,"Albert Hall Mansions, Kensington Gore, London, SW7","With spectacular views overlooking Hyde Park and the Albert Memorial this bright and spacious four bedroom lateral apartment with exceptional room dimensions and high ceilings, as well as a large balcony which directly overlooks Hyde Park and the Royal Albert Hall. This property is offered with s...","£6,500,000",21/02/2019,"Wedgewood Estates, London",https://media.rightmove.co.uk:443/dir/crop/10:9-16:9/103k/102385/93792053/102385_2445010_IMG_01_0002_max_476x317.jpg
4 bedroom town house for sale,"Blandford Street, London, W1U","FREEHOLD: 4 Bedrooms, 5 Bathrooms, Reception Room with Dining Area, Kitchen with Breakfast Area, Jacuzzi Pool, Lift to All Floors, Off Street Parking Space","£6,500,000",12/02/2020,"Lord Estates, London",https://media.rightmove.co.uk:443/dir/crop/10:9-16:9/76k/75139/74181098/75139_B-103S_IMG_13_0000_max_476x317.jpg
24 bedroom block of apartments for sale,"Stanley Gardens, London","The Power House - Formerly a battery factory during the war years, this warehouse conversion has now been developed into 13 residential units. Featuring a mixture of brand new conversions and new builds, each space has high ceilings and superb natural light. Due for completion circa Easter 2020 t...","£6,500,000",27/02/2020,"Aston Rowe, Brook Green & Hammersmith",https://media.rightmove.co.uk:443/dir/crop/10:9-16:9/59k/58551/78066364/58551_29515793_IMG_01_0000_max_476x317.jpg
2 bedroom flat for sale,"Curzon Street, Mayfair, London, W1J","A beautifully presented 2 bedroom apartment for sale in Mayfair Four newly developed apartments, giving excellent well designed lateral space. All the apartments are presented in immaculate condition with Holly Hunt furniture throughout and Porta Romana lighting, silk curtains, blinds and hand t...","£6,500,000",06/08/2019,"Knight Frank, Mayfair",https://media.rightmove.co.uk:443/dir/crop/10:9-16:9/66k/65815/74937980/65815_WER180059_IMG_08_0002_max_476x317.jpg
3 bedroom penthouse for sale,"Harbour Avenue,
London,
SW10","This beautiful penthouse is located in one London's most exclusive developments Chelsea island which contains just 89 luxury apartments. Occupying an entire floor , Flooded with natural light and finished to a very high specification including a David Linley handmade kitchen. ","£6,500,000",13/07/2020,Chelsea Island Developments Ltd,https://media.rightmove.co.uk:443/dir/crop/10:9-16:9/224k/223973/94468976/223973_PHC_IMG_00_0000_max_476x317.jpg
3 bedroom terraced house for sale,"Vicarage Gate, London, W8","A beautiful Interior designed three Bedroom Garden maisonette. Vicarage Gate House is a prestigious development of just 13 apartments designed by leading London architect, Eric Parry Private Entrance, 24hr concierge, underground valet parking and well equipped gym.","£6,500,000",17/03/2020,"Hamptons International Sales, Kensington",https://media.rightmove.co.uk:443/dir/crop/10:9-16:9/38k/37922/90551039/37922_KEN190166_IMG_01_0000_max_476x317.jpg
2 bedroom apartment for sale,"Curzon Street, Mayfair, London, W1J","Four newly developed lateral apartments, offering beautifully designed lateral space.","£6,500,000",06/08/2019,"Savills, Mayfair",https://media.rightmove.co.uk:443/dir/crop/10:9-16:9/50k/49602/83477912/49602_MAS180034_IMG_02_0000_max_476x317.jpg
2 bedroom apartment for sale,"Rutland Gardens, London, SW7","This elegant and spacious two bedroom apartment is situated within Rutland Court, a magnificent red brick period mansion block on a private road. The 2,219 sq ft apartment offers wonderful proportions and high ceilings throughout. A generous entrance hall gives access to a stunning drawing ro...","£6,500,000",16/01/2020,"Beauchamp Estates Ltd, Mayfair - Resale",https://media.rightmove.co.uk:443/dir/crop/10:9-16:9/80k/79099/76824007/79099_1021983703_IMG_01_0000_max_476x317.jpg
8 bedroom house for sale,"Hampton Court Road, East Molesey, KT8","A magnificent Grade II listed eight bedroom, four bathroom country home comprising of formal reception rooms, family room, dining room and drawing room, plus a grand entrance hall, study, utility room and wine cellar. Located on the second floor is a grand master suite with ensuite, plus seve...","£6,500,000",06/02/2020,"Beauchamp Estates Ltd, Mayfair - Resale",https://media.rightmove.co.uk:443/dir/crop/10:9-16:9/80k/79099/77281366/79099_1022287005_IMG_01_0000_max_476x317.jpg
