title,address,description,price,date,seller,image
3 bedroom terraced house for sale,"Pawsons Road, Croydon, CR0",Virtual Viewing available !!! We are pleased to offer this three bedroom Victorian mid terraced house with back garden. Close to both train stations and good schools this is the perfect family home. Don't miss out book a vieiwng today.,"£375,000",10/08/2020,"Streets Ahead, South Norwood",https://media.rightmove.co.uk:443/dir/crop/10:9-16:9/182k/181634/91959275/181634_ADD200121_IMG_01_0000_max_476x317.jpg
10 bedroom semi-detached house for sale,"Hyde Park Place, Hyde Park, London, W2","10 bedroom house for sale in Hyde Park W2 For sale a beautifully restored Grade II listed 10 bedroom family house in Hyde Park W2 offering fantastic views across the park and located within close proximity to Marble Arch and the amenities of Connaught Village.
EPC: D. Built towards the end ...","£45,000,000",18/07/2020,"Knight Frank, Hyde Park",https://media.rightmove.co.uk:443/dir/crop/10:9-16:9/51k/50634/82344178/50634_PCL170142_IMG_01_0000_max_476x317.jpg
7 bedroom semi-detached house for sale,"Walton Street, Knightsbridge, London, SW3","A 7 bedroom converted church for sale in Knightsbridge St Saviours is a unique Grade II listed historical building that has been converted into an extraordinary modern seven bedroom home. The property benefits from a vaulted ceiling, original stone pillars, beautiful views and parking for three ...","£44,000,000",03/04/2020,"Knight Frank, Belgravia, covering Westminster",https://media.rightmove.co.uk:443/dir/crop/10:9-16:9/95k/94745/78656785/94745_PCL180065_IMG_01_0000_max_476x317.jpg
6 bedroom house for sale,"Queen Anne's Gate, St James's Park","Arranged over three floors and offering in excess of 11480 square feet of immaculately presented and voluminous living space, this elegantly appointed six bedroom, seven bathroom family residence, with 24 hour porterage, is accessed via a private entrance and notably has sole use of and direct","£41,500,000",16/10/2019,"The Cloister, London",https://media.rightmove.co.uk:443/dir/crop/10:9-16:9/52k/51305/94228469/51305_5503_IMG_01_0000_max_476x317.jpg
6 bedroom house for sale,"South Street, Mayfair W1K","Considered to be the archetypical London mansion, this exceptional Mayfair mansion sits in the heart of central London. In excess of 8,300 sq ft, the sensitive modernisation of the six-bedroom townhouse included the creation of a wellness suite on the lower ground floor, complete with swimming pool.","£40,000,000",14/02/2020,"Rokstone, London",https://media.rightmove.co.uk:443/dir/crop/10:9-16:9/177k/176396/89685296/176396_1781_ROKS_IMG_01_0000_max_476x317.jpg
10 bedroom detached house for sale,"Merton Lane, London, N6","Exceptional Contemporary Mansion in Highgate Located on a sought after road and occupying a 2 acre site, a bespoke family home with the accommodation predominantly arranged over three floors with the benefit of a substantial, self-contained staff lodge. The luxurious entrance hall of this stun...","£40,000,000",23/10/2019,"Knight Frank, Hampstead",https://media.rightmove.co.uk:443/dir/crop/10:9-16:9/66k/65806/79055890/65806_HAM130309_IMG_01_0000_max_476x317.jpg
10 bedroom detached house for sale,"Merton Lane, London, N6","Located on a sought-after road in the heart of Highgate and occupying a two-acre site, a bespoke family home with the accommodation predominantly arranged over three floors with the benefit of a substantial, self-contained staff lodge. The luxurious entrance hall of this stunning home has a glass...",POA,22/10/2019,"'s International Realty, London",https://media.rightmove.co.uk:443/dir/crop/10:9-16:9/63k/62080/74956453/62080_NLD180216_IMG_03_0000_max_476x317.jpg
7 bedroom terraced house for sale,"Ilchester Place, Holland Park, London, W14","An exquisite seven bedroom family house on one of Kensington’s most coveted addresses An exquisite seven bedroom family house on one of Kensington's most coveted addresses, which has been completely rebuilt and extended behind its original façade. Set within the Holland Park Conservation Area a...","£35,000,000",30/06/2020,"Knight Frank, Kensington",https://media.rightmove.co.uk:443/dir/crop/10:9-16:9/66k/65809/81517927/65809_KEN012089368_IMG_01_0002_max_476x317.jpg
6 bedroom terraced house for sale,"Cadogan Place, Belgravia, London, SW1X",A SPECTACULAR GRADE II LISTED HOUSE REFURBISHED AND INTERIOR DESIGNED TO A VERY HIGH STANDARD AND SPECIFICATION DIRECTLY OVERLOOKING CADOGAN PLACE GARDENS.,"£34,000,000",09/01/2020,"Savills, Knightsbridge",https://media.rightmove.co.uk:443/dir/crop/10:9-16:9/26k/25602/88192172/25602_KNH170031_IMG_01_0000_max_476x317.jpg
60 bedroom house for sale,"Lexham Gardens, Kensington","A superb investment opportunity to acquire 60 room freehold hotel ideally situated in the heart of prestigious Kensington, widely recognised as one of London's finest addresses.","£33,000,000",14/11/2019,"The Cloister, London",https://media.rightmove.co.uk:443/dir/crop/10:9-16:9/52k/51305/94228598/51305_5598_IMG_01_0000_max_476x317.jpg
6 bedroom apartment for sale,"Wellington Court, Knightsbridge SW1X","Considered to be one of London`s most prestigious penthouse, directly opposite One Hyde Park, this outstanding apartment with direct lift access, comprises of six bedroom suites, spacious reception areas and multiple terraces with direct views overlooking Hyde Park.","£32,500,000",27/03/2019,"Rokstone, London",https://media.rightmove.co.uk:443/dir/crop/10:9-16:9/177k/176396/80460026/176396_1263_IMG_01_0000_max_476x317.jpg
3 bedroom apartment for sale,"One Hyde Park, Knightsbridge",This truly exceptional apartment located in the most sought after location is now available. The grand property boasts magnificent views of both Knightsbridge and Hyde Park. One Hyde Park is offering luxury London living at it's absolute finest.,"£30,000,000",18/09/2019,"The Cloister, London",https://media.rightmove.co.uk:443/dir/crop/10:9-16:9/52k/51305/94223729/51305_5399_IMG_01_0000_max_476x317.jpg
8 bedroom detached house for sale,"Upper Phillimore Gardens, Kensington, London, W8","Detached 8 bedroom detached family house with lift, garden, terrace and separate garage This fabulous detached family house offers exceptional proportions throughout. Situated on one of London's finest residential addresses within the Phillimore Estate, this eight-bedroom house has been designed...","£29,950,000",06/07/2020,"Knight Frank, Kensington",https://media.rightmove.co.uk:443/dir/crop/10:9-16:9/66k/65809/94278710/65809_KEN060206_IMG_01_0000_max_476x317.jpg
10 bedroom detached house for sale,"Upper Phillimore Gardens, Kensington, London, W8","A classic white stucco fronted 10 bedroom house in prime Kensington Located on one of London's finest residential addresses, this ten bedroom house has been extensively remodelled and re-designed to the most exacting standards and utilising some of the most luxurious finishes available. Approx...","£29,950,000",13/04/2016,"Knight Frank, Kensington",https://media.rightmove.co.uk:443/dir/crop/10:9-16:9/66k/65809/92781332/65809_KEN150213_IMG_01_0000_max_476x317.jpg
10 bedroom detached house for sale,"Upper Phillimore Gardens, London, W8","Located on one of London's finest residential addresses, this detached ten bedroom house with lift and garage, has been extensively remodelled and re-designed to the most exacting standards and utilising some of the most luxurious finishes available. Set back from the street, behind its own lands...","£29,950,000",25/03/2019,"John D Wood & Co. Sales, Kensington",https://media.rightmove.co.uk:443/dir/crop/10:9-16:9/1k/675/70700242/675_CST150362_IMG_01_0000_max_476x317.jpg
7 bedroom detached house for sale,"Phillimore Gardens, Kensington, London, W8",An elegant detached house overlooking Holland Park for sale in W8 A rarely available detached house with parking on the Phillimore Estate with west facing views over Holland Park. The house has substantial proportions offering impressive reception rooms and a sensible layout of accommodation wit...,POA,22/01/2019,"Knight Frank, Kensington",https://media.rightmove.co.uk:443/dir/crop/10:9-16:9/66k/65809/76905467/65809_KEN160118_IMG_01_0010_max_476x317.jpg
7 bedroom detached house for sale,"Phillimore Gardens, Kensington, London","A very special detached seven bedroom family house with off-street parking and a lovely south-west facing garden backing onto Holland Park. This impressive and wide house occupies approximately 6,520 sq ft and is very well arranged over five floors","£28,500,000",16/07/2020,"Strutt & Parker, Kensington",https://media.rightmove.co.uk:443/dir/crop/10:9-16:9/55k/54859/57755931/54859_CSD170419_IMG_01_0000_max_476x317.jpg
8 bedroom detached house for sale,"Elsworthy Road, Primrose Hill, London, NW3","VIRTUAL TOUR & PROPERTY VIDEO AVAILABLE An elegant beautifully refurbished interior designed detached home (932.2 sq m/10,035 sq ft) originally built in accommodation with a lift serving all floors, a carriage driveway and a rear garden with direct access to magnificent, extensive ...","£28,500,000",09/04/2019,"Aston Chase, London",https://media.rightmove.co.uk:443/dir/crop/10:9-16:9/85k/84235/80794139/84235_RGS190106_IMG_01_0000_max_476x317.jpg
3 bedroom flat for sale,"One Hyde Park, Knightsbridge, London, SW1X","A beautiful, Hyde Park facing, three bedroom duplex apartment in iconic One Hyde Park An exceptional duplex family apartment of 4,441 sq ft with the formal reception room overlooking Hyde Park and the Serpentine. The apartment offers a wonderful reception room with large terrace area, three bed...","£28,000,000",01/07/2020,"Knight Frank, Knightsbridge",https://media.rightmove.co.uk:443/dir/crop/10:9-16:9/66k/65827/94277630/65827_SLA012051572_IMG_01_0000_max_476x317.jpg
6 bedroom town house for sale,"Chapel Street, Belgravia SW1X","A magnificent, exceptionally well presented six bedroom freehold town house situated in the heart of Belgravia, moments away from Knightsbridge. ","£28,000,000",25/10/2019,"Rokstone, London",https://media.rightmove.co.uk:443/dir/crop/10:9-16:9/177k/176396/85982015/176396_517_ROKS_IMG_01_0001_max_476x317.jpg
8 bedroom house for sale,"Hamilton Terrace, London, NW8","This imposing house in Hamilton Terrace has been built to the highest of specifications, and interior designed by Bill Bennette to offer a glamorous, contemporary space, ideal for entertaining and stylish family living. There is a gated driveway with parking for two cars at the front and stone...","£27,500,000",03/09/2019,"Beauchamp Estates Ltd, Mayfair - Resale",https://media.rightmove.co.uk:443/dir/crop/10:9-16:9/80k/79099/64810998/79099_1017365935_IMG_01_0001_max_476x317.jpg
11 bedroom detached house for sale,"Hamilton Terrace, St John's Wood, London, NW8","This imposing house in Hamilton Terrace has been built to the highest of specifications, and interior designed by Bill Bennette to offer a glamorous, contemporary space, ideal for entertaining and stylish family living. There is a gated driveway with parking for two cars at the front a...","£27,500,000",03/09/2019,"Aston Chase, London",https://media.rightmove.co.uk:443/dir/crop/10:9-16:9/85k/84235/73890214/84235_RGS190249_IMG_01_0000_max_476x317.jpg
House for sale,Princes Gate,"Over 9000sqft, meticulously renovated landmark house bordering Knightsbridge & South Kensington.","£27,000,000",20/02/2020,"Nest Seekers International , London",https://media.rightmove.co.uk:443/dir/crop/10:9-16:9/193k/192446/89624204/192446_NEST_RM_192446_1311024_IMG_01_0000_max_476x317.jpg
4 bedroom house for sale,"Stratford Place, Marylebone","A superlative Grade II listed four bedroom, four bathroom townhouse, with lift, magnificently situated on a quiet cul-de-sac moments from Oxford Street, Bond Street and the world class amenities of Mayfair.",POA,15/11/2019,"The Cloister, London",https://media.rightmove.co.uk:443/dir/crop/10:9-16:9/52k/51305/94228448/51305_5481_IMG_01_0000_max_476x317.jpeg
8 bedroom house for sale,"Knightsbridge, Knightsbridge","A handsome eight bedroom, four reception room Grade II listed stucco fronted house of magnificent proportion with lift and roof terrace, prestigiously situated in Knightsbridge.","£27,000,000",02/03/2020,"The Cloister, London",https://media.rightmove.co.uk:443/dir/crop/10:9-16:9/52k/51305/94222280/51305_750_IMG_01_0000_max_476x317.jpg
1 bedroom flat for sale,"Rotherhithe Street, London SE16","A modern one bedroom, ground floor apartment with a spacious living room and a separate kitchen/diner, well presented throughout and conveniently located within close distance to Canada Water tube station together with the transport links and abundance of amenities in Surrey Quays. The TFL Riverb...","£450,000",10/08/2020,"ludlowthompson, Canada Water",https://media.rightmove.co.uk:443/dir/crop/10:9-16:9/64k/63765/83299363/63765_2667384_IMG_01_0000_max_476x317.jpg
5 bedroom flat for sale,"One Kensington Gardens, Kensington Road, London W8",An exclusive five bedroom apartment overlooking Kensington Palace Gardens. ,"£26,000,000",07/10/2019,"Strutt & Parker, London - New Homes",https://media.rightmove.co.uk:443/dir/crop/10:9-16:9/97k/96919/65597634/96919_LNW190086_IMG_01_0000_max_476x317.jpg
5 bedroom terraced house for sale,"Park Street, London, W1K","An exceptional 5 bedroom Mayfair Townhouse Arranged over 6 floors and situated within a prime Mayfair location, this mansion house offers a grande entrance hall, separate catering kitchen, staff quarters and access to the private Green Street Gardens. EPC: D. This spacious 5 bedroom town ho...","£25,900,000",07/09/2018,"Knight Frank, Mayfair",https://media.rightmove.co.uk:443/dir/crop/10:9-16:9/66k/65815/75447035/65815_POD180323_IMG_01_0001_max_476x317.jpg
6 bedroom detached house for sale,"Hamilton Terrace, St John's Wood, London, NW8","A 6 bedroom Georgian house for sale in St Johns Wood, NW8 A magnificent 12,435 sq ft Georgian house built circa 1850 that has been the subject of a major renovation behind the period façade. EPC D. An elegant period, detached, freehold house, refurbished and remodelled to the highest of sta...","£25,000,000",13/07/2018,"Knight Frank, St John's Wood",https://media.rightmove.co.uk:443/dir/crop/10:9-16:9/66k/65830/73393096/65830_SJW120142_IMG_01_0000_max_476x317.jpg
9 bedroom detached house for sale,"Holland Park, Holland Park, London, W11",An exceptional freehold redevelopment opportunity located on one of London’s most prestigious streets.,POA,05/03/2020,"Savills, Notting Hill",https://media.rightmove.co.uk:443/dir/crop/10:9-16:9/90k/89770/77967130/89770_NOH190047_IMG_01_0000_max_476x317.jpg
8 bedroom detached house for sale,"Avenue Road, NW8","'A very rare Freehold mansion, nestled in a double-width garden, available for sale for the first time in 60 years.' We are privileged to introduce this unique property, which offers the fortunate buyer a rare combination of privacy and grand living, in one of London's most sophisticated...","£25,000,000",29/01/2020,"Glentree Estates Ltd, London",https://media.rightmove.co.uk:443/dir/crop/10:9-16:9/191k/190037/67945350/190037_28618841_IMG_01_0000_max_476x317.jpg
5 bedroom terraced house for sale,"Park Place, St James's, London, SW1A","An immaculate town house located in the heart of St James’s, which seamlessly blends contemporary design, luxurious materials and unique charm, all set behind a striking black brick façade.","£25,000,000",10/06/2019,"Savills, Mayfair",https://media.rightmove.co.uk:443/dir/crop/10:9-16:9/50k/49602/83477891/49602_MAS170108_IMG_06_0000_max_476x317.jpg
5 bedroom terraced house for sale,"The Grande House, St James's, London, SW1A","An exceptional and unique 5/6 bedroom town house for sale in St James's SW1 The Grande House, 12 Park Place is an immaculate new build town house located in the heart of St James's, which seamlessly blends contemporary design, luxurious materials and unique charm, all set behind a striking black...","£25,000,000",10/06/2019,"Knight Frank, Mayfair",https://media.rightmove.co.uk:443/dir/crop/10:9-16:9/66k/65815/76006889/65815_WER160027_IMG_01_0003_max_476x317.jpg
6 bedroom detached house for sale,"Hamilton Terrace, St John's Wood, London NW8","An elegant period, detached, freehold house, refurbished and remodelled to the highest of standards, incorporating generous bedroom suites, luxurious entertaining spaces and magnificent lower ground level leisure facilities with swimming pool, bar area, gymnasium, Jacuzzi, sauna and home cinema. ...","£25,000,000",25/06/2019,"Ian Green Residential, London",https://media.rightmove.co.uk:443/dir/crop/10:9-16:9/74k/73947/79100050/73947_28886638_IMG_01_0000_max_476x317.jpg
5 bedroom detached house for sale,"Hamilton Terrace, St Johns Wood, London, NW8",A magnificent Georgian detached family home situated on this prestigious tree lined boulevard.,"£25,000,000",02/08/2019,"Savills, St John's Wood & Regent's Park",https://media.rightmove.co.uk:443/dir/crop/10:9-16:9/79k/78202/64130025/78202_STS150012_IMG_01_0000_max_476x317.jpg
7 bedroom detached house for sale,"Addison Road, Holland Park, London, W14","A stunning Holland Park family home with a large garden & parking Rebuilt approximately six years ago to the highest standard, this is an exceptional property with great lateral space, large garden and off street parking. The house has excellent entertaining space which includes a cinema room an...","£25,000,000",22/11/2019,"Knight Frank, Kensington",https://media.rightmove.co.uk:443/dir/crop/10:9-16:9/66k/65809/86869814/65809_KEN190147_IMG_01_0002_max_476x317.jpg
3 bedroom apartment for sale,"One Hyde Park, Knightsbridge",This truly exceptional apartment located in the most sought after location is now available. The grand property boasts magnificent views of both Knightsbridge and Hyde Park. One Hyde Park is offering luxury London living at it's absolute finest.,"£25,000,000",18/09/2019,"The Cloister, London",https://media.rightmove.co.uk:443/dir/crop/10:9-16:9/52k/51305/94223705/51305_5394_IMG_01_0000_max_476x317.jpg
7 bedroom semi-detached house for sale,"Bedford Gardens, Kensington, London, W8","A beautifully presented period listed house, semi-detached and refurbished to an exceptionally high standard and located on one of Kensington’s most sought after roads. The house is set back from the street behind electric gates and a deep front garden and has the benefit of gene...","£25,000,000",13/02/2020,"Aylesford International, Chelsea",https://media.rightmove.co.uk:443/dir/crop/10:9-16:9/43k/42848/89384909/42848_CHE190002_IMG_01_0001_max_476x317.jpg
8 bedroom house for sale,"Cornwall Terrace, London, NW1","Located on the south-west corner of Regent's Park on Cornwall Terrace, Silk House presents a magnificent Grade I listed home with stunning views over Regent's Park. This impressive six bedroom home has been meticulously restored to the specification of the Crown Estate and English Heritage and...","£25,000,000",09/01/2020,"Beauchamp Estates Ltd, Mayfair - Resale",https://media.rightmove.co.uk:443/dir/crop/10:9-16:9/80k/79099/76665631/79099_1001448361_IMG_01_0000_max_476x317.png
6 bedroom detached house for sale,"Compton Avenue, Highgate, London, N6","Exclusive freehold development opportunity with planning permission located close to Hampstead Heath. The site extends to approximately c.0.89 acres (0.36 hectares) and occupies a quiet position at the end of a private cul-de-sac. It currently comprises a large detached house extending to 11,840...",POA,yesterday,"Knight Frank - New Homes, Prime Central London Developments",https://media.rightmove.co.uk:443/dir/crop/10:9-16:9/42k/41063/83329669/41063_HAM012040870_IMG_01_0000_max_476x317.jpg
5 bedroom flat for sale,"Lennox Gardens, London","Situated over three prime floors of an elegant Grade II listed building, the property offers spacious living and entertaining space spanning an impressive 5,280 sq ft.","£24,750,000",17/05/2020,"Strutt & Parker, Knightsbridge",https://media.rightmove.co.uk:443/dir/crop/10:9-16:9/45k/44264/72394869/44264_SLN200031_IMG_01_0000_max_476x317.jpg
4 bedroom apartment for sale,"Mayfair Park Residences, London, W1","Stunning lateral space in Mayfair A stunning example of a grand Mayfair home, benefiting from lateral space across three buildings. With hotel servicing provided by the adjacent 45 Park Lane, 5.01 at Mayfair Park Residences will provide the owner with sophisticated Mayfair living on a par wit...","£24,500,000",12/05/2020,"JLL, London Residential Developments",https://media.rightmove.co.uk:443/dir/crop/10:9-16:9/101k/100183/70436646/100183_LWN38901_IMG_01_0000_max_476x317.jpg
6 bedroom terraced house for sale,"Victoria Road, Kensington, London, W8","An exceptional low built villa for sale in the heart of Kensington, W8 A unique and substantial double fronted villa near Kensington Palace and Hyde Park. The house has been built to the highest standards and provides desirable off-street parking for two cars and a spa with swimming pool. Approx...","£24,000,000",23/01/2020,"Knight Frank, Knightsbridge",https://media.rightmove.co.uk:443/dir/crop/10:9-16:9/66k/65827/88684766/65827_SLA150165_IMG_01_0001_max_476x317.jpg
4 bedroom apartment for sale,"Chelsea Barracks, Residence 35, 8 Whistler Square, London, SW1W","Situated on the fifth floor, this beautiful four-bedroom residence offers elegant lateral living spaces, where floor to ceiling windows open up wonderful vistas of Whistler Square.","£24,000,000",31/01/2020,"Savills New Homes, Margaret Street",https://media.rightmove.co.uk:443/dir/crop/10:9-16:9/49k/48985/77143537/48985_LAD153129_IMG_01_0000_max_476x317.jpg
Detached house for sale,"Winnington Road, N2","One of the finest houses to come onto the market, approached by a magnificent carriage driveway is this ambassadorial detached residence built ten years ago, standing in its own grounds. The house features a grand central staircase in beautiful white marble with ornate balustrades. The a...","£23,000,000",25/11/2019,"Glentree Estates Ltd, London",https://media.rightmove.co.uk:443/dir/crop/10:9-16:9/191k/190037/66614865/190037_29291104_IMG_06_0000_max_476x317.jpg
5 bedroom flat for sale,"Eaton Square, Belgravia, SW1W","An exceptional opportunity to acquire a grand apartment of impressive proportions, occupying a superb position on the north terrace of Eaton Square. The property further benefits from a private garden (under a separate licence). ","£22,500,000",27/05/2020,"Chestertons Estate Agents , Knightsbridge",https://media.rightmove.co.uk:443/dir/crop/10:9-16:9/32k/31608/94916549/31608_CHE200026_IMG_01_0000_max_476x317.jpg
8 bedroom terraced house for sale,"Lygon Place, London, SW1W","Set over an immaculate four floors (with passenger lift), Lygon Place has been beautifully refurbished, incorporating contemporary technology, whilst maintaining many of property's original period features including the timber flooring, cornicing and fireplaces. Arranged over a beautiful cour...","£22,500,000",12/03/2020,"Beauchamp Estates Ltd, Mayfair - Resale",https://media.rightmove.co.uk:443/dir/crop/10:9-16:9/80k/79099/78152401/79099_1022814012_IMG_01_0000_max_476x317.jpg
4 bedroom flat for sale,"St. James's House, 88 St. James's Street, London","The Clarence has been finished to the highest specification combinging its historic legacy with luxury modern features, impeccable services and facilities.","£22,500,000",02/07/2020,"Strutt & Parker, London - New Homes",https://media.rightmove.co.uk:443/dir/crop/10:9-16:9/97k/96919/81627481/96919_LNW200046_IMG_01_0000_max_476x317.jpg
6 bedroom semi-detached house for sale,"Wilton Mews, Belgravia, London, SW1X","NEW BUILD 6 bedroom house for sale An exceptional recently constructed family residence located in the heart of Belgravia, just off Belgrave Square and Eaton Square, extending close to 10,000 square feet of accommodation. EPC: C This entirely new build house has been interior desi...","£22,000,000",02/03/2020,"Knight Frank, Belgravia, covering Westminster",https://media.rightmove.co.uk:443/dir/crop/10:9-16:9/95k/94745/77865331/94745_RDR140142_IMG_01_0000_max_476x317.jpg
3 bedroom apartment for sale,"One Hyde Park, Knightsbridge","The Cloister are pleased to present this stunning three bedroom apartment located in Knightsbridge, One Hyde Park, a prestigious and much sought-after location.","£22,000,000",18/09/2019,"The Cloister, London",https://media.rightmove.co.uk:443/dir/crop/10:9-16:9/52k/51305/94223693/51305_5393_IMG_01_0000_max_476x317.jpg
3 bedroom maisonette for sale,"Meredith Street, London, E13","BOOK ONLINE TODAY 24/7 at PURPLEBRICKS.CO.UK **Offers in the Region of £350,000 ** Offered for sale is this very well presented first floor, three-bedroom Maisonette, located on a quiet tree-lined turning in Plaistow. The ground floor comprises of a wide hallway leading to a bright & airy re...","£350,000",today,"Purplebricks, covering London",https://media.rightmove.co.uk:443/dir/crop/10:9-16:9/152k/151079/83391469/151079_999107-1_IMG_01_0000_max_476x317.jpg
5 bedroom mews house for sale,"Wilton Mews, London, SW1X","A wonderful family house located in the heart of Belgravia, just off Belgrave Square. This entirely new build house has been interior designed and project managed by the renowned prime central London firm, Finchatton. The property has impressive lateral space, with large reception rooms w...","£22,000,000",20/03/2020,"Beauchamp Estates Ltd, Mayfair - Resale",https://media.rightmove.co.uk:443/dir/crop/10:9-16:9/80k/79099/78330697/79099_1022978035_IMG_01_0000_max_476x317.jpg
